subreddit_id,approved_at_utc,author_is_blocked,comment_type,awarders,mod_reason_by,banned_by,author_flair_type,total_awards_received,author_flair_template_id,likes,user_reports,saved,id,banned_at_utc,mod_reason_title,gilded,archived,collapsed_reason_code,no_follow,can_mod_post,created_utc,send_replies,parent_id,score,author_fullname,approved_by,mod_note,all_awardings,collapsed,body,edited,top_awarded_type,author_flair_css_class,name,is_submitter,downs,author_flair_richtext,author_patreon_flair,body_html,removal_reason,collapsed_reason,distinguished,associated_award,stickied,author_premium,can_gild,gildings,unrepliable_reason,author_flair_text_color,score_hidden,permalink,subreddit_type,locked,report_reasons,created,author_flair_text,treatment_tags,link_id,subreddit_name_prefixed,controversiality,depth,author_flair_background_color,collapsed_because_crowd_control,mod_reports,num_reports,ups,_fetched,synctimestamp,created_utc_string,author_screen_name,top_level_comment,parent_thread_id,parent_comment_id,author_id
2qxt5,,False,,[],,,text,0,,,[],False,k2prnpo,,,0,False,,False,False,1695991148.0,True,16v5lff,54,t2_13ct6qbd,,,[],False,Biden warns U. S. ~~at risk of~~ *certain to* slide into ~~authoritarianism~~ Christo-fascist nightmare if ~~Trump~~ Orange Hitler ~~returns to power~~ slithers back into power.,False,,,t1_k2prnpo,False,0,[],False,"<div class=""md""><p>Biden warns U. S. <del>at risk of</del> <em>certain to</em> slide into <del>authoritarianism</del> Christo-fascist nightmare if <del>Trump</del> Orange Hitler <del>returns to power</del> slithers back into power.</p>
</div>",,,,,False,False,False,{},,,False,/r/Liberal/comments/16v5lff/biden_warns_us_at_risk_of_slide_into/k2prnpo/,public,False,,1695991148.0,,[],t3_16v5lff,r/Liberal,0,0,,,[],,54,True,2023-10-15T09:02:24.992363,"Friday, September 29, 2023, at 08:39:08 PM",meresymptom,True,16v5lff,,13ct6qbd
2qxt5,,False,,[],,,text,0,,,[],False,k2r7vvg,,,0,False,,False,False,1696010976.0,True,k2prnpo,26,t2_8n8gwef5t,,,[],False,"EVERYONE should know about ""Project 2025 - Mandate For Leadership, the Conservative Promise,"" available at www.project2025.org, the literal Republican playbook, put together by the Heritage Foundation and 45 other conservative entities like Alliance Defending Freedom, Claremont Institute, and Moms For Liberty. It was first handed to Reagan, who merely enacted the policy within it. Same with Trump - they are two heads of the same snake. Their vision for a Christofascist theocracy and just how they intend to implement it are painstakingly detailed. 

Their plan is to dismantle the federal government and remove our rights, TO BEGIN WITH. It's fucking chilling and you should at least read the foreword, a dense 17 pages of GOP philosophy that outlines their mission. Fossil fuels are a big part of it. God and guns and nothing else for everyone. Sealed borders. Everyone will be free to live ""as our creator ordained,"" in those words. If that doesn't terrify you idk what will.",False,,,t1_k2r7vvg,False,0,[],False,"<div class=""md""><p>EVERYONE should know about &quot;Project 2025 - Mandate For Leadership, the Conservative Promise,&quot; available at <a href=""http://www.project2025.org"">www.project2025.org</a>, the literal Republican playbook, put together by the Heritage Foundation and 45 other conservative entities like Alliance Defending Freedom, Claremont Institute, and Moms For Liberty. It was first handed to Reagan, who merely enacted the policy within it. Same with Trump - they are two heads of the same snake. Their vision for a Christofascist theocracy and just how they intend to implement it are painstakingly detailed. </p>

<p>Their plan is to dismantle the federal government and remove our rights, TO BEGIN WITH. It&#39;s fucking chilling and you should at least read the foreword, a dense 17 pages of GOP philosophy that outlines their mission. Fossil fuels are a big part of it. God and guns and nothing else for everyone. Sealed borders. Everyone will be free to live &quot;as our creator ordained,&quot; in those words. If that doesn&#39;t terrify you idk what will.</p>
</div>",,,,,False,True,False,{},,,False,/r/Liberal/comments/16v5lff/biden_warns_us_at_risk_of_slide_into/k2r7vvg/,public,False,,1696010976.0,,[],t3_16v5lff,r/Liberal,0,1,,,[],,26,True,2023-10-15T09:02:25.407074,"Saturday, September 30, 2023, at 02:09:36 AM",StellerDay,False,16v5lff,k2prnpo,8n8gwef5t
2qxt5,,False,,[],,,text,0,,,[],False,k2rnaqj,,,0,False,,False,False,1696016655.0,True,k2r7vvg,7,t2_7453o,,,[],False,Is Matt Shae involved in this fuckery?,False,,,t1_k2rnaqj,False,0,[],False,"<div class=""md""><p>Is Matt Shae involved in this fuckery?</p>
</div>",,,,,False,False,False,{},,,False,/r/Liberal/comments/16v5lff/biden_warns_us_at_risk_of_slide_into/k2rnaqj/,public,False,,1696016655.0,,[],t3_16v5lff,r/Liberal,0,2,,,[],,7,True,2023-10-15T09:02:25.812800,"Saturday, September 30, 2023, at 03:44:15 AM",Eskimoobob,False,16v5lff,k2r7vvg,7453o
2qxt5,,False,,[],,,text,0,,,[],False,k2ssvzj,,,0,False,,True,False,1696033267.0,True,k2r7vvg,3,t2_ov6wgo3b,,,[],False,"I wonder if they will make us herd goats after they empty the cities.

😆

This is some chilling stuff. Search for Leeja Miller on YouTube. She is a lawyer and she did a mini documentary about this Project 2025.",False,,,t1_k2ssvzj,False,0,[],False,"<div class=""md""><p>I wonder if they will make us herd goats after they empty the cities.</p>

<p>😆</p>

<p>This is some chilling stuff. Search for Leeja Miller on YouTube. She is a lawyer and she did a mini documentary about this Project 2025.</p>
</div>",,,,,False,False,False,{},,,False,/r/Liberal/comments/16v5lff/biden_warns_us_at_risk_of_slide_into/k2ssvzj/,public,False,,1696033267.0,,[],t3_16v5lff,r/Liberal,0,2,,,[],,3,True,2023-10-15T09:02:26.237808,"Saturday, September 30, 2023, at 08:21:07 AM",Illustrious-Style-38,False,16v5lff,k2r7vvg,ov6wgo3b
2qxt5,,False,,[],,,text,0,,,[],False,k2vk5ur,,,0,False,,True,False,1696089049.0,True,k2ssvzj,1,t2_883vh,,,[],True,"Here is the link to the mini doc. 

https://youtu.be/9k3UvaC5m7o?si=gMYVwXgI8oVl7HU_",False,,,t1_k2vk5ur,False,0,[],False,"<div class=""md""><p>Here is the link to the mini doc. </p>

<p><a href=""https://youtu.be/9k3UvaC5m7o?si=gMYVwXgI8oVl7HU_"">https://youtu.be/9k3UvaC5m7o?si=gMYVwXgI8oVl7HU_</a></p>
</div>",,,,,False,False,False,{},,,False,/r/Liberal/comments/16v5lff/biden_warns_us_at_risk_of_slide_into/k2vk5ur/,public,False,,1696089049.0,,[],t3_16v5lff,r/Liberal,0,3,,,[],,1,True,2023-10-15T09:02:26.669905,"Saturday, September 30, 2023, at 11:50:49 PM",Diplomat_of_swing,False,16v5lff,k2ssvzj,883vh
2qxt5,,False,,[],,,text,0,,,[],False,k2qerhb,,,0,False,,False,False,1696000386.0,True,16v5lff,15,t2_j6qxf,,,[],False,Well he’s right,False,,,t1_k2qerhb,False,0,[],False,"<div class=""md""><p>Well he’s right</p>
</div>",,,,,False,False,False,{},,,False,/r/Liberal/comments/16v5lff/biden_warns_us_at_risk_of_slide_into/k2qerhb/,public,False,,1696000386.0,,[],t3_16v5lff,r/Liberal,0,0,,,[],,15,True,2023-10-15T09:02:27.093485,"Friday, September 29, 2023, at 11:13:06 PM",BinaryMan151,True,16v5lff,,j6qxf
2qxt5,,False,,[],,,text,0,,,[],False,k2sq5bq,,,0,False,,True,False,1696032022.0,True,k2qerhb,1,t2_wq606nq,,,[],False,Yup. You can say it's obvious but it absolutely needs to be said.,False,,,t1_k2sq5bq,False,0,[],False,"<div class=""md""><p>Yup. You can say it&#39;s obvious but it absolutely needs to be said.</p>
</div>",,,,,False,False,False,{},,,False,/r/Liberal/comments/16v5lff/biden_warns_us_at_risk_of_slide_into/k2sq5bq/,public,False,,1696032022.0,,[],t3_16v5lff,r/Liberal,0,1,,,[],,1,True,2023-10-15T09:02:27.530606,"Saturday, September 30, 2023, at 08:00:22 AM",ScroungingMonkey,False,16v5lff,k2qerhb,wq606nq
2qxt5,,False,,[],,,text,0,,,[],False,k2pp9an,,,0,False,,False,False,1695990027.0,True,16v5lff,21,t2_44qvtkey,,,[],False,It’s a nightmare scenario. He will align with Putin and move to destroy liberalism entirely.,False,,,t1_k2pp9an,False,0,[],False,"<div class=""md""><p>It’s a nightmare scenario. He will align with Putin and move to destroy liberalism entirely.</p>
</div>",,,,,False,False,False,{},,,False,/r/Liberal/comments/16v5lff/biden_warns_us_at_risk_of_slide_into/k2pp9an/,public,False,,1695990027.0,,[],t3_16v5lff,r/Liberal,0,0,,,[],,21,True,2023-10-15T09:02:27.950959,"Friday, September 29, 2023, at 08:20:27 PM",roundearthervaxxer,True,16v5lff,,44qvtkey
2qxt5,,False,,[],,,text,0,,,[],False,k2qli7p,,,0,False,,False,False,1696002837.0,True,16v5lff,8,t2_aqxzuch,,,[],False,"If you read orenge guy's rhetoric on social media, he's basically is saying ""when I'm president I'm going to make them all pay for trying to hold me legally accountable""",False,,,t1_k2qli7p,False,0,[],False,"<div class=""md""><p>If you read orenge guy&#39;s rhetoric on social media, he&#39;s basically is saying &quot;when I&#39;m president I&#39;m going to make them all pay for trying to hold me legally accountable&quot;</p>
</div>",,,,,False,False,False,{},,,False,/r/Liberal/comments/16v5lff/biden_warns_us_at_risk_of_slide_into/k2qli7p/,public,False,,1696002837.0,,[],t3_16v5lff,r/Liberal,0,0,,,[],,8,True,2023-10-15T09:02:28.356017,"Friday, September 29, 2023, at 11:53:57 PM",a_burdie_from_hell,True,16v5lff,,aqxzuch
2qxt5,,False,,[],,,text,0,,,[],False,k2r5aam,,,0,False,,True,False,1696010030.0,True,16v5lff,3,t2_ju091,,,[],False,Is there a limit to how many times he can run?,False,,,t1_k2r5aam,False,0,[],False,"<div class=""md""><p>Is there a limit to how many times he can run?</p>
</div>",,,,,False,False,False,{},,,False,/r/Liberal/comments/16v5lff/biden_warns_us_at_risk_of_slide_into/k2r5aam/,public,False,,1696010030.0,,[],t3_16v5lff,r/Liberal,0,0,,,[],,3,True,2023-10-15T09:02:28.779075,"Saturday, September 30, 2023, at 01:53:50 AM",Filmmagician,True,16v5lff,,ju091
2qxt5,,False,,[],,,text,0,,,[],False,k2smssa,,,0,False,,True,False,1696030524.0,True,k2r5aam,3,t2_38eey,,,[],False,"**Short answer-**

No.  He can run as many times as he wants, but he can only win twice.  Technically, if he serves the two terms (Even non-consecutively), he can't run again after that, but that's only after a hypothetical second term, not after another loss.  He can run and lose forever until he gets that second term or dies- if he wants to keep running.  He could even legally run from prison if he winds up there.

The only President ever to be elected to two *non-consecutive* terms was Grover Cleveland.

**Long answer-**

The constitutional limit is that you can only serve two terms.  This was at first just a tradition begun by George Washington, the first President under the present 1789 constitution, who chose to only serve two terms, but then a constitutional amendment was passed legally after Franklin Roosevelt (FDR) was elected to, I think, four terms, in the Great Depression/World War 2 era.

FDR might have been re-elected to even more terms ***if*** he hadn't suffered a bad heart attack or something of that nature during his last term.  He was very popular- credited with both getting us out of the Great Depression and winning World War 2 (Though Truman mopped up in the Pacific after FDR died in office.  Truman is also the one who decided to drop the nukes on Japan.  I'm not saying FDR wouldn't have done it- we'll never know if he would have or wouldn't have.).  We also have FDR to thank for Social Security, though I think in fairness I should at least mention the huge black mark on his record- the internment of Japanese-American citizens during World War 2 (Trivia: George Takei, the original Lt. Sulu on Star Trek, who is still alive, had his family interned when he was a child and still has memories of that time.).

To be clear, Roosevelt was well within his legal rights to serve all those terms, because the two term ""limit"" was only a very informal tradition back then, but it is the law now, and a modern President would not be.

The only ways around that are:

\- Pass a constitutional amendment changing the law, which would be virtually impossible in the current political climate because of the high threshold of support it'd need.   It's been a while since a constitutional amendment for anything was passed.

There's a long argument about whether or not the Equal Rights Amendment (for women) was enacted or not, but the short version is that the courts do not recognize it as having been enacted, so it is not functionally law, though some people think the courts are wrong.  It's not relevant to Trump anyhow.

\- Be Vice-President when a President passes away, after which \*I think\* in certain cases, if you're just briefly President under those circumstances, it may not count against the two term limit (But that would probably never apply to Trump- I can't see him running for Vice-President at this point \[Another improbable scenario- if no one gets 270 electoral votes in a Presidential election, I think the House picks the President and the Senate picks the VP, which could result in a Biden-Trump or a Trump-Biden administration (I'm not sure if it's the outgoing or incoming Congress that votes).  I don't think that's ever happened, though.  In order for it to happen, there would almost certainly have to be a third party candidate who wins some states and blocks the leading vote getter from hitting 270, and there's no one projected to be running who could do that right now.  Things can change, but... probably not.\].  And it'd have to be a situation where he hadn't already served a second term as President, like he becomes VP and then is elevated to the Presidency briefly at the end of his running mate's term, and then is allowed to run again.  If he's served two full terms as President, he's not even eligible to *run* for Vice-President.).

\- Turn America in an autocracy or authoritarian state and just ignore the constitution and the law and declare yourself dictator for life, hold an illegal plebiscite where people vote you into office for life, run for a third term even though it's clearly illegal and somehow get on the ballot and get the Senate to illegal receive the electors, or get the Supreme Court to rule against the clear meaning of a constitutional amendment that was solely enacted to prevent that.

Everything under option three would be the end of American democracy and the legitimate rule of law.

&#x200B;

But he can legally keep running until he gets that second term or dies- if he wants to.

President Biden has actually run for President 3 times- 1988, 2008, and 2020 (Though he only ran in the primaries the first two times, failing to get his party's nomination).  2024 will his 4th time running for President.

Jimmy Carter is on only other living one-term President other than Donald Trump and, I guess, Joe Biden, though Biden could still win in 2024 and be a two consecutive term President.  Technically, Carter could run again if he wanted to, but he recently turned 99 years old, was in hospice care a few months ago, hasn't shown an interest in running for anything in 40+ years, and voted for Joe Biden in 2020, so it would be beyond shocking if he actually did it.  He just legally would be allowed to.

I think there are some third-party candidates who kept running again and again in the past, losing every time, but I can't think of them off the top of my head.  Everyone that comes to mind only ran once or twice.  But I just have a vaguely recollection of seeing some people toss their hats in the ring constantly.  I know Ross Perot only ran twice (Random historical note: Donald Trump strongly considered running for Ross Perot's Reform Party's 2000 nomination to the point where he had political advisors mailing free copies of his book to Reform Party activists and was criticizing Pat Buchanan, the eventual Reform Party nominee that year.  Ironically, one of the big things he criticized Buchanan and his supporters for were what he claimed were ties to David Duke.  David Duke endorsed Trump when Trump ran as a Republican in 2016, and when asked by the press if he'd denounced Duke's endorsement, Trump claimed to not know who he was, an obvious lie.  For the sake of clarity, I should mention that Perot wasn't a far-right guy like the people who took over his party in 2000 when he decided not to run.).  I think Ralph Nader and Ron Paul only ran twice, but I could be wrong about either or both of them.

In any event, yes, Trump can keep running until he wins (After which he'd be constitutionally barred from running again), passes away, or gets sick of running.

Realistically, I would think after a second loss, assuming he didn't stage a successful coup afterward, his support would probably drop in every subsequent election he'd lose.  His whole brand is projecting the false impression that he's a winner when it comes to everything he tries.  The more he loses, the more hits that image will take among his supporters and potential supporters.

**Disclaimer:** I did 99% of this from memory.  It's just too much information for me to go look it all up and double check that it's all correct.  So, if you need it for something important- please double check.  But it's accurate *to the best of the my knowledge* as someone who started following politics at age 6 and took a lot of history courses.",1696031401.0,,,t1_k2smssa,True,0,[],False,"<div class=""md""><p><strong>Short answer-</strong></p>

<p>No.  He can run as many times as he wants, but he can only win twice.  Technically, if he serves the two terms (Even non-consecutively), he can&#39;t run again after that, but that&#39;s only after a hypothetical second term, not after another loss.  He can run and lose forever until he gets that second term or dies- if he wants to keep running.  He could even legally run from prison if he winds up there.</p>

<p>The only President ever to be elected to two <em>non-consecutive</em> terms was Grover Cleveland.</p>

<p><strong>Long answer-</strong></p>

<p>The constitutional limit is that you can only serve two terms.  This was at first just a tradition begun by George Washington, the first President under the present 1789 constitution, who chose to only serve two terms, but then a constitutional amendment was passed legally after Franklin Roosevelt (FDR) was elected to, I think, four terms, in the Great Depression/World War 2 era.</p>

<p>FDR might have been re-elected to even more terms <strong><em>if</em></strong> he hadn&#39;t suffered a bad heart attack or something of that nature during his last term.  He was very popular- credited with both getting us out of the Great Depression and winning World War 2 (Though Truman mopped up in the Pacific after FDR died in office.  Truman is also the one who decided to drop the nukes on Japan.  I&#39;m not saying FDR wouldn&#39;t have done it- we&#39;ll never know if he would have or wouldn&#39;t have.).  We also have FDR to thank for Social Security, though I think in fairness I should at least mention the huge black mark on his record- the internment of Japanese-American citizens during World War 2 (Trivia: George Takei, the original Lt. Sulu on Star Trek, who is still alive, had his family interned when he was a child and still has memories of that time.).</p>

<p>To be clear, Roosevelt was well within his legal rights to serve all those terms, because the two term &quot;limit&quot; was only a very informal tradition back then, but it is the law now, and a modern President would not be.</p>

<p>The only ways around that are:</p>

<p>- Pass a constitutional amendment changing the law, which would be virtually impossible in the current political climate because of the high threshold of support it&#39;d need.   It&#39;s been a while since a constitutional amendment for anything was passed.</p>

<p>There&#39;s a long argument about whether or not the Equal Rights Amendment (for women) was enacted or not, but the short version is that the courts do not recognize it as having been enacted, so it is not functionally law, though some people think the courts are wrong.  It&#39;s not relevant to Trump anyhow.</p>

<p>- Be Vice-President when a President passes away, after which *I think* in certain cases, if you&#39;re just briefly President under those circumstances, it may not count against the two term limit (But that would probably never apply to Trump- I can&#39;t see him running for Vice-President at this point [Another improbable scenario- if no one gets 270 electoral votes in a Presidential election, I think the House picks the President and the Senate picks the VP, which could result in a Biden-Trump or a Trump-Biden administration (I&#39;m not sure if it&#39;s the outgoing or incoming Congress that votes).  I don&#39;t think that&#39;s ever happened, though.  In order for it to happen, there would almost certainly have to be a third party candidate who wins some states and blocks the leading vote getter from hitting 270, and there&#39;s no one projected to be running who could do that right now.  Things can change, but... probably not.].  And it&#39;d have to be a situation where he hadn&#39;t already served a second term as President, like he becomes VP and then is elevated to the Presidency briefly at the end of his running mate&#39;s term, and then is allowed to run again.  If he&#39;s served two full terms as President, he&#39;s not even eligible to <em>run</em> for Vice-President.).</p>

<p>- Turn America in an autocracy or authoritarian state and just ignore the constitution and the law and declare yourself dictator for life, hold an illegal plebiscite where people vote you into office for life, run for a third term even though it&#39;s clearly illegal and somehow get on the ballot and get the Senate to illegal receive the electors, or get the Supreme Court to rule against the clear meaning of a constitutional amendment that was solely enacted to prevent that.</p>

<p>Everything under option three would be the end of American democracy and the legitimate rule of law.</p>

<p>&#x200B;</p>

<p>But he can legally keep running until he gets that second term or dies- if he wants to.</p>

<p>President Biden has actually run for President 3 times- 1988, 2008, and 2020 (Though he only ran in the primaries the first two times, failing to get his party&#39;s nomination).  2024 will his 4th time running for President.</p>

<p>Jimmy Carter is on only other living one-term President other than Donald Trump and, I guess, Joe Biden, though Biden could still win in 2024 and be a two consecutive term President.  Technically, Carter could run again if he wanted to, but he recently turned 99 years old, was in hospice care a few months ago, hasn&#39;t shown an interest in running for anything in 40+ years, and voted for Joe Biden in 2020, so it would be beyond shocking if he actually did it.  He just legally would be allowed to.</p>

<p>I think there are some third-party candidates who kept running again and again in the past, losing every time, but I can&#39;t think of them off the top of my head.  Everyone that comes to mind only ran once or twice.  But I just have a vaguely recollection of seeing some people toss their hats in the ring constantly.  I know Ross Perot only ran twice (Random historical note: Donald Trump strongly considered running for Ross Perot&#39;s Reform Party&#39;s 2000 nomination to the point where he had political advisors mailing free copies of his book to Reform Party activists and was criticizing Pat Buchanan, the eventual Reform Party nominee that year.  Ironically, one of the big things he criticized Buchanan and his supporters for were what he claimed were ties to David Duke.  David Duke endorsed Trump when Trump ran as a Republican in 2016, and when asked by the press if he&#39;d denounced Duke&#39;s endorsement, Trump claimed to not know who he was, an obvious lie.  For the sake of clarity, I should mention that Perot wasn&#39;t a far-right guy like the people who took over his party in 2000 when he decided not to run.).  I think Ralph Nader and Ron Paul only ran twice, but I could be wrong about either or both of them.</p>

<p>In any event, yes, Trump can keep running until he wins (After which he&#39;d be constitutionally barred from running again), passes away, or gets sick of running.</p>

<p>Realistically, I would think after a second loss, assuming he didn&#39;t stage a successful coup afterward, his support would probably drop in every subsequent election he&#39;d lose.  His whole brand is projecting the false impression that he&#39;s a winner when it comes to everything he tries.  The more he loses, the more hits that image will take among his supporters and potential supporters.</p>

<p><strong>Disclaimer:</strong> I did 99% of this from memory.  It&#39;s just too much information for me to go look it all up and double check that it&#39;s all correct.  So, if you need it for something important- please double check.  But it&#39;s accurate <em>to the best of the my knowledge</em> as someone who started following politics at age 6 and took a lot of history courses.</p>
</div>",,,,,False,False,False,{},,,False,/r/Liberal/comments/16v5lff/biden_warns_us_at_risk_of_slide_into/k2smssa/,public,False,,1696030524.0,,[],t3_16v5lff,r/Liberal,0,1,,,[],,3,True,2023-10-15T09:02:29.268496,"Saturday, September 30, 2023, at 07:35:24 AM",CharmCityCrab,False,16v5lff,k2r5aam,38eey
