subreddit_id,approved_at_utc,author_is_blocked,comment_type,awarders,mod_reason_by,banned_by,author_flair_type,total_awards_received,author_flair_template_id,likes,user_reports,saved,id,banned_at_utc,mod_reason_title,gilded,archived,collapsed_reason_code,no_follow,can_mod_post,created_utc,send_replies,parent_id,score,author_fullname,approved_by,mod_note,all_awardings,collapsed,body,edited,top_awarded_type,author_flair_css_class,name,is_submitter,downs,author_flair_richtext,author_patreon_flair,body_html,removal_reason,collapsed_reason,distinguished,associated_award,stickied,author_premium,can_gild,gildings,unrepliable_reason,author_flair_text_color,score_hidden,permalink,subreddit_type,locked,report_reasons,created,author_flair_text,treatment_tags,link_id,subreddit_name_prefixed,controversiality,depth,author_flair_background_color,collapsed_because_crowd_control,mod_reports,num_reports,ups,_fetched,synctimestamp,created_utc_string,author_screen_name,top_level_comment,parent_thread_id,parent_comment_id,author_id
2qxt5,,False,,[],,,text,0,,,[],False,dn5nq3b,,,0,True,,False,False,1505709821.0,True,70qvk4,103,t2_9li3z,,,[],False,This is extremely dangerous rhetoric ,False,,,t1_dn5nq3b,False,0,[],False,"<div class=""md""><p>This is extremely dangerous rhetoric </p>
</div>",,,,,False,False,False,{},,,False,/r/Liberal/comments/70qvk4/there_is_no_such_thing_as_a_good_trump_voter/dn5nq3b/,public,False,,1505709821.0,,[],t3_70qvk4,r/Liberal,0,0,,,[],,103,True,2023-10-14T11:24:48.161578,"Monday, September 18, 2017, at 12:43:41 PM",Quackinator100,True,70qvk4,,9li3z
2qxt5,,False,,[],,,text,0,,,[],False,dn6omdo,,,0,True,,False,False,1505768650.0,True,dn5nq3b,13,t2_ko5w9,,,[],False,And bullshit to boot!,False,,,t1_dn6omdo,False,0,[],False,"<div class=""md""><p>And bullshit to boot!</p>
</div>",,,,,False,False,False,{},,,False,/r/Liberal/comments/70qvk4/there_is_no_such_thing_as_a_good_trump_voter/dn6omdo/,public,False,,1505768650.0,,[],t3_70qvk4,r/Liberal,0,1,,,[],,13,True,2023-10-14T11:24:48.574478,"Tuesday, September 19, 2017, at 05:04:10 AM",sideofbutterplease,False,70qvk4,dn5nq3b,ko5w9
2qxt5,,False,,[],,,text,0,,,[],False,dn5nkni,,,0,True,,False,False,1505709527.0,True,70qvk4,70,t2_aneo4,,,[],False,"So this author grew up around racists. I grew up around racist suburban moms who undoubtedly voted for Hillary, and who avoid driving through the black neighborhoods because it's scary. You cant equate people who voted republican together with racists, just like you cant equate people who voted democrat with having the moral high ground. 

This article is so bad, I feel dumber for having read it. ",False,,,t1_dn5nkni,False,0,[],False,"<div class=""md""><p>So this author grew up around racists. I grew up around racist suburban moms who undoubtedly voted for Hillary, and who avoid driving through the black neighborhoods because it&#39;s scary. You cant equate people who voted republican together with racists, just like you cant equate people who voted democrat with having the moral high ground. </p>

<p>This article is so bad, I feel dumber for having read it. </p>
</div>",,,,,False,False,False,{},,,False,/r/Liberal/comments/70qvk4/there_is_no_such_thing_as_a_good_trump_voter/dn5nkni/,public,False,,1505709527.0,,[],t3_70qvk4,r/Liberal,0,0,,,[],,70,True,2023-10-14T11:24:48.998215,"Monday, September 18, 2017, at 12:38:47 PM",ACannabisConnoisseur,True,70qvk4,,aneo4
2qxt5,,False,,[],,,text,0,,,[],False,dn5v85i,,,0,True,,False,False,1505729526.0,True,dn5nkni,19,t2_rckqn,,,[],False,rawstory.com is a liberal Breitbart. That's not a good thing. ,False,,,t1_dn5v85i,False,0,[],False,"<div class=""md""><p>rawstory.com is a liberal Breitbart. That&#39;s not a good thing. </p>
</div>",,,,,False,False,False,{},,,False,/r/Liberal/comments/70qvk4/there_is_no_such_thing_as_a_good_trump_voter/dn5v85i/,public,False,,1505729526.0,,[],t3_70qvk4,r/Liberal,0,1,,,[],,19,True,2023-10-14T11:24:49.413491,"Monday, September 18, 2017, at 06:12:06 PM",ToAskMoreQuestions,False,70qvk4,dn5nkni,rckqn
2qxt5,,False,,[],,,text,0,,,[],False,dn6nty8,,,0,True,,False,False,1505767787.0,True,dn5nkni,5,t2_qy4xo,,,[],False,"People are trying to define people, who are generally enormously complex, by one variable.",False,,,t1_dn6nty8,False,0,[],False,"<div class=""md""><p>People are trying to define people, who are generally enormously complex, by one variable.</p>
</div>",,,,,False,False,False,{},,,False,/r/Liberal/comments/70qvk4/there_is_no_such_thing_as_a_good_trump_voter/dn6nty8/,public,False,,1505767787.0,,[],t3_70qvk4,r/Liberal,0,1,,,[],,5,True,2023-10-14T11:24:49.868844,"Tuesday, September 19, 2017, at 04:49:47 AM",BrosephLenin,False,70qvk4,dn5nkni,qy4xo
2qxt5,,False,,[],,,text,0,,,[],False,dn5nifs,,,0,True,,False,False,1505709411.0,True,70qvk4,32,t2_xlsqq,,,[],False,"I don't think that it's accurate to judge the morality of someone who voted for Trump based on that decision. It's also pretty unhelpful to the current political climate.

Both candidates were pretty horrible in different ways, but to define the supporters of said candidates by the worst of the traits of their respective candidates is indefensible. We can't judge people's morality because of their single vote.

Each candidate has positives that caused the supporters and voters of said candidates to overlook the negatives. 

Trump Supporters are different case all together, but I don't think they should be labeled by the worst of his traits either, although there are definitely racists in that group.",False,,,t1_dn5nifs,False,0,[],False,"<div class=""md""><p>I don&#39;t think that it&#39;s accurate to judge the morality of someone who voted for Trump based on that decision. It&#39;s also pretty unhelpful to the current political climate.</p>

<p>Both candidates were pretty horrible in different ways, but to define the supporters of said candidates by the worst of the traits of their respective candidates is indefensible. We can&#39;t judge people&#39;s morality because of their single vote.</p>

<p>Each candidate has positives that caused the supporters and voters of said candidates to overlook the negatives. </p>

<p>Trump Supporters are different case all together, but I don&#39;t think they should be labeled by the worst of his traits either, although there are definitely racists in that group.</p>
</div>",,,,,False,False,False,{},,,False,/r/Liberal/comments/70qvk4/there_is_no_such_thing_as_a_good_trump_voter/dn5nifs/,public,False,,1505709411.0,,[],t3_70qvk4,r/Liberal,0,0,,,[],,32,True,2023-10-14T11:24:50.320080,"Monday, September 18, 2017, at 12:36:51 PM",FrigidArrow,True,70qvk4,,xlsqq
2qxt5,,False,,[],,,text,0,,,[],False,dn5v0po,,,0,True,,False,False,1505728910.0,True,70qvk4,26,t2_92t34,,,[],False,This is the kind of article headline that invites people to criticize liberals. ,False,,,t1_dn5v0po,False,0,[],False,"<div class=""md""><p>This is the kind of article headline that invites people to criticize liberals. </p>
</div>",,,,,False,False,False,{},,,False,/r/Liberal/comments/70qvk4/there_is_no_such_thing_as_a_good_trump_voter/dn5v0po/,public,False,,1505728910.0,,[],t3_70qvk4,r/Liberal,0,0,,,[],,26,True,2023-10-14T11:24:50.739532,"Monday, September 18, 2017, at 06:01:50 PM",HelelMorningstar,True,70qvk4,,92t34
2qxt5,,False,,[],,,text,0,,,[],False,dn5xsai,,,0,True,,False,False,1505735862.0,True,70qvk4,18,t2_gyyva,,,[],False,cmon what the hell is this,False,,,t1_dn5xsai,False,0,[],False,"<div class=""md""><p>cmon what the hell is this</p>
</div>",,,,,False,False,False,{},,,False,/r/Liberal/comments/70qvk4/there_is_no_such_thing_as_a_good_trump_voter/dn5xsai/,public,False,,1505735862.0,,[],t3_70qvk4,r/Liberal,0,0,,,[],,18,True,2023-10-14T11:24:51.157557,"Monday, September 18, 2017, at 07:57:42 PM",p4t262,True,70qvk4,,gyyva
2qxt5,,False,,[],,,text,0,,,[],False,dn63s37,,,0,True,,False,False,1505744876.0,True,dn5xsai,10,t2_79z6uvs,,,[],False,It's complete garbo. Pretty much the crazy left. The ones that make us look bad.,False,,,t1_dn63s37,False,0,[],False,"<div class=""md""><p>It&#39;s complete garbo. Pretty much the crazy left. The ones that make us look bad.</p>
</div>",,,,,False,False,False,{},,,False,/r/Liberal/comments/70qvk4/there_is_no_such_thing_as_a_good_trump_voter/dn63s37/,public,False,,1505744876.0,,[],t3_70qvk4,r/Liberal,0,1,,,[],,10,True,2023-10-14T11:24:51.597925,"Monday, September 18, 2017, at 10:27:56 PM",PupNSudsSkates,False,70qvk4,dn5xsai,79z6uvs
2qxt5,,False,,[],,,text,0,,,[],False,dn6aayb,,,0,True,,False,False,1505752314.0,True,70qvk4,5,t2_7b0yc,,,[],False,This is a really bad mindset and not how we should feel about such a large group. Divisiveness is dangerous.,False,,,t1_dn6aayb,False,0,[],False,"<div class=""md""><p>This is a really bad mindset and not how we should feel about such a large group. Divisiveness is dangerous.</p>
</div>",,,,,False,False,False,{},,,False,/r/Liberal/comments/70qvk4/there_is_no_such_thing_as_a_good_trump_voter/dn6aayb/,public,False,,1505752314.0,,[],t3_70qvk4,r/Liberal,0,0,,,[],,5,True,2023-10-14T11:24:52.040589,"Tuesday, September 19, 2017, at 12:31:54 AM",JoeDiesAtTheEnd,True,70qvk4,,7b0yc
2qxt5,,False,,[],,,text,0,,,[],False,dn6otcu,,,0,True,,False,False,1505768870.0,True,70qvk4,6,t2_xhozq,,,[],False,"Yeah sure. Condemn, isolate and ostracize 35% of the population. That's totally not going to cause further receding into their echo chambers and increase radicalization. Nope. I see no problems with this. ",False,,,t1_dn6otcu,False,0,[],False,"<div class=""md""><p>Yeah sure. Condemn, isolate and ostracize 35% of the population. That&#39;s totally not going to cause further receding into their echo chambers and increase radicalization. Nope. I see no problems with this. </p>
</div>",,,,,False,False,False,{},,,False,/r/Liberal/comments/70qvk4/there_is_no_such_thing_as_a_good_trump_voter/dn6otcu/,public,False,,1505768870.0,,[],t3_70qvk4,r/Liberal,0,0,,,[],,6,True,2023-10-14T11:24:52.447073,"Tuesday, September 19, 2017, at 05:07:50 AM",TurkeyBaconClubberin,True,70qvk4,,xhozq
2qxt5,,False,,[],,,text,0,,,[],False,dnc6qso,,,0,True,,True,False,1506047385.0,True,70qvk4,2,t2_gou1e,,,[],False,https://imgur.com/a/e935o,False,,,t1_dnc6qso,False,0,[],False,"<div class=""md""><p><a href=""https://imgur.com/a/e935o"">https://imgur.com/a/e935o</a></p>
</div>",,,,,False,False,False,{},,,False,/r/Liberal/comments/70qvk4/there_is_no_such_thing_as_a_good_trump_voter/dnc6qso/,public,False,,1506047385.0,,[],t3_70qvk4,r/Liberal,0,0,,,[],,2,True,2023-10-14T11:24:52.848703,"Friday, September 22, 2017, at 10:29:45 AM",ihateradiohead,True,70qvk4,,gou1e
2qxt5,,False,,[],,,text,0,,,[],False,dn6u8an,,,0,True,,True,False,1505775296.0,True,70qvk4,1,t2_12tdp1,,,[],False,"If a person votes for a degenerate racist piece of shit like Trump, that says something inherently negative about that person.

If a person continues to support a degenerate racist piece of shit like Trump, that says something inherently unacceptable about that person.

If other people, who claim to mean well, then accept these voters as just another legitimate opinion, that says something about these other people. Being accepting and accommodating to those who are unapologetic about their disdain for others, is not a legitimate political position. 

Why apologize and accommodate a group of people who support, defend and fund the open hatred of others?",False,,,t1_dn6u8an,False,0,[],False,"<div class=""md""><p>If a person votes for a degenerate racist piece of shit like Trump, that says something inherently negative about that person.</p>

<p>If a person continues to support a degenerate racist piece of shit like Trump, that says something inherently unacceptable about that person.</p>

<p>If other people, who claim to mean well, then accept these voters as just another legitimate opinion, that says something about these other people. Being accepting and accommodating to those who are unapologetic about their disdain for others, is not a legitimate political position. </p>

<p>Why apologize and accommodate a group of people who support, defend and fund the open hatred of others?</p>
</div>",,,,,False,False,False,{},,,False,/r/Liberal/comments/70qvk4/there_is_no_such_thing_as_a_good_trump_voter/dn6u8an/,public,False,,1505775296.0,,[],t3_70qvk4,r/Liberal,0,0,,,[],,1,True,2023-10-14T11:24:53.631879,"Tuesday, September 19, 2017, at 06:54:56 AM",Spiel_Foss,True,70qvk4,,12tdp1
2qxt5,,False,,[],,,text,0,,,[],False,dn6127r,,,0,True,LOW_SCORE,True,False,1505741353.0,True,70qvk4,-5,t2_g4ngl,,,[],True,"Anyone who is STILL a trump supporter, is a racist.",False,,,t1_dn6127r,False,0,[],False,"<div class=""md""><p>Anyone who is STILL a trump supporter, is a racist.</p>
</div>",,comment score below threshold,,,False,False,False,{},,,False,/r/Liberal/comments/70qvk4/there_is_no_such_thing_as_a_good_trump_voter/dn6127r/,public,False,,1505741353.0,,[],t3_70qvk4,r/Liberal,1,0,,,[],,-5,True,2023-10-14T11:24:54.036296,"Monday, September 18, 2017, at 09:29:13 PM",StonerMeditation,True,70qvk4,,g4ngl
2qxt5,,False,,[],,,text,0,,,[],False,dn6k0c9,,,0,True,,True,False,1505763674.0,True,70qvk4,-2,t2_dx537nx,,,[],False,Great piece. Love this.,False,,,t1_dn6k0c9,False,0,[],False,"<div class=""md""><p>Great piece. Love this.</p>
</div>",,,,,False,False,False,{},,,False,/r/Liberal/comments/70qvk4/there_is_no_such_thing_as_a_good_trump_voter/dn6k0c9/,public,False,,1505763674.0,,[],t3_70qvk4,r/Liberal,0,0,,,[],,-2,True,2023-10-14T11:24:54.423366,"Tuesday, September 19, 2017, at 03:41:14 AM",lelattejoe,True,70qvk4,,dx537nx
2qxt5,,False,,[],,,text,0,,,[],False,ibo1hru,,,0,True,,False,False,1654729597.0,True,v825zn,89,t2_5hoc2,,,[],False,"You're going to have a hard time finding too many large, nation-wide companies (*Culver's included*) that ***aren't*** run by diehard republicans. In order to be president/CEO of a company that large you basically have to care about money and nothing else. These are the kinds of people who hate taxes and want to do anything and everything to save a buck. Sooo. . . Republicans.

 Shop local whenever possible, or at least try to stick to large national chains where the CEO has the decency to keep his mouth shut and not turn his political views into a big public spectacle. This is the reason I haven't bought a Papa John's pizza since 2010 or stepped foot in a Hobby Lobby in over a decade.

Edit: I said ""You're going to have a hard time finding too many large. . . companies that aren't run by diehard republicans."" I ***didn't*** say "" There are absolutely zero companies larger than a lemonade stand run by liberals. None. Not a single one ever anywhere, period.""

There's a difference.",1654737644.0,,,t1_ibo1hru,False,0,[],False,"<div class=""md""><p>You&#39;re going to have a hard time finding too many large, nation-wide companies (<em>Culver&#39;s included</em>) that <strong><em>aren&#39;t</em></strong> run by diehard republicans. In order to be president/CEO of a company that large you basically have to care about money and nothing else. These are the kinds of people who hate taxes and want to do anything and everything to save a buck. Sooo. . . Republicans.</p>

<p>Shop local whenever possible, or at least try to stick to large national chains where the CEO has the decency to keep his mouth shut and not turn his political views into a big public spectacle. This is the reason I haven&#39;t bought a Papa John&#39;s pizza since 2010 or stepped foot in a Hobby Lobby in over a decade.</p>

<p>Edit: I said &quot;You&#39;re going to have a hard time finding too many large. . . companies that aren&#39;t run by diehard republicans.&quot; I <strong><em>didn&#39;t</em></strong> say &quot; There are absolutely zero companies larger than a lemonade stand run by liberals. None. Not a single one ever anywhere, period.&quot;</p>

<p>There&#39;s a difference.</p>
</div>",,,,,False,False,False,{},,,False,/r/Liberal/comments/v825zn/serious_question_would_it_be_safe_to_eat_at/ibo1hru/,public,False,,1654729597.0,,[],t3_v825zn,r/Liberal,0,0,,,[],,89,True,2023-10-14T11:24:55.783449,"Thursday, June 09, 2022, at 07:06:37 AM",DerCatzefragger,True,v825zn,,5hoc2
2qxt5,,False,,[],,,text,0,,,[],False,ibokr7r,,,0,True,,False,False,1654739226.0,True,ibo1hru,20,t2_62spl,,,[],False,"Could not agree more, as I climbed the corporate ladder. The outright demand that I treat the workers below me like shit, so I could get a larger profit share really started to rub me the wrong way.

But the people who have no problem saying just layoff 15% of the workforce do more with less. Those are the people who are promoted and rise up the chain of command. Because all they care about is their paycheck and making it bigger and bigger.

I like to freak out the Republicans I work with by telling him that the top six people at our companies make $40 million between the six of them. They’re generally outraged and furious because they haven’t gotten a raise in years and they cut off 401(k) match during Covid, all the while keeping the dividend in place.

But they’ll never stop voting R because they want their guns.

This is only going to change, if people vote for candidates that are honestly going to hold corporate America responsible for their greed.",False,,,t1_ibokr7r,False,0,[],False,"<div class=""md""><p>Could not agree more, as I climbed the corporate ladder. The outright demand that I treat the workers below me like shit, so I could get a larger profit share really started to rub me the wrong way.</p>

<p>But the people who have no problem saying just layoff 15% of the workforce do more with less. Those are the people who are promoted and rise up the chain of command. Because all they care about is their paycheck and making it bigger and bigger.</p>

<p>I like to freak out the Republicans I work with by telling him that the top six people at our companies make $40 million between the six of them. They’re generally outraged and furious because they haven’t gotten a raise in years and they cut off 401(k) match during Covid, all the while keeping the dividend in place.</p>

<p>But they’ll never stop voting R because they want their guns.</p>

<p>This is only going to change, if people vote for candidates that are honestly going to hold corporate America responsible for their greed.</p>
</div>",,,,,False,False,False,{},,,False,/r/Liberal/comments/v825zn/serious_question_would_it_be_safe_to_eat_at/ibokr7r/,public,False,,1654739226.0,,[],t3_v825zn,r/Liberal,0,1,,,[],,20,True,2023-10-14T11:24:56.663481,"Thursday, June 09, 2022, at 09:47:06 AM",bstevens2,False,v825zn,ibo1hru,62spl
2qxt5,,False,,[],,,text,0,,,[],False,ibo9oyg,,,0,True,,False,False,1654733715.0,True,ibo1hru,22,t2_32o34,,,[],False,You missed Chic Fil A.,False,,,t1_ibo9oyg,False,0,[],False,"<div class=""md""><p>You missed Chic Fil A.</p>
</div>",,,,,False,False,False,{},,,False,/r/Liberal/comments/v825zn/serious_question_would_it_be_safe_to_eat_at/ibo9oyg/,public,False,,1654733715.0,,[],t3_v825zn,r/Liberal,0,1,,,[],,22,True,2023-10-14T11:24:57.064499,"Thursday, June 09, 2022, at 08:15:15 AM",BeeSilver9,False,v825zn,ibo1hru,32o34
2qxt5,,False,,[],,,text,0,,,[],False,iboiuek,,,0,True,,False,False,1654738281.0,True,ibo9oyg,13,t2_di24u,,,[],False,And Goya. And Yuengling.,False,,,t1_iboiuek,False,0,[],False,"<div class=""md""><p>And Goya. And Yuengling.</p>
</div>",,,,,False,False,False,{},,,False,/r/Liberal/comments/v825zn/serious_question_would_it_be_safe_to_eat_at/iboiuek/,public,False,,1654738281.0,,[],t3_v825zn,r/Liberal,0,2,,,[],,13,True,2023-10-14T11:24:57.500031,"Thursday, June 09, 2022, at 09:31:21 AM",acobildo,False,v825zn,ibo9oyg,di24u
2qxt5,,False,,[],,,text,0,,,[],False,ibopcyq,,,0,True,,False,False,1654741524.0,True,ibo1hru,3,t2_12vtbu,,,[],False,I wish more people understood this.,False,,,t1_ibopcyq,False,0,[],False,"<div class=""md""><p>I wish more people understood this.</p>
</div>",,,,,False,False,False,{},,,False,/r/Liberal/comments/v825zn/serious_question_would_it_be_safe_to_eat_at/ibopcyq/,public,False,,1654741524.0,,[],t3_v825zn,r/Liberal,0,1,,,[],,3,True,2023-10-14T11:24:57.896047,"Thursday, June 09, 2022, at 10:25:24 AM",interstatebus,False,v825zn,ibo1hru,12vtbu
2qxt5,,False,,[],,,text,0,,,[],False,ibp5z0m,,,0,True,,True,False,1654751047.0,True,ibo1hru,2,t2_ahjwe,,,[],False,The edit is right,False,,,t1_ibp5z0m,False,0,[],False,"<div class=""md""><p>The edit is right</p>
</div>",,,,,False,False,False,{},,,False,/r/Liberal/comments/v825zn/serious_question_would_it_be_safe_to_eat_at/ibp5z0m/,public,False,,1654751047.0,,[],t3_v825zn,r/Liberal,0,1,,,[],,2,True,2023-10-14T11:24:58.291064,"Thursday, June 09, 2022, at 01:04:07 PM",ABpro90,False,v825zn,ibo1hru,ahjwe
2qxt5,,False,,[],,,text,0,,,[],False,ibov00q,,,0,True,,False,False,1654744438.0,True,v825zn,6,t2_4x7nxqxx,,,[],False,If you only eat / purchase from liberal organizations/ companies you will likely starve to death or have a very limited options. Some companies are obvious about their political views but many are not. I am willing to not go to x company on y day for specific protest day.,False,,,t1_ibov00q,False,0,[],False,"<div class=""md""><p>If you only eat / purchase from liberal organizations/ companies you will likely starve to death or have a very limited options. Some companies are obvious about their political views but many are not. I am willing to not go to x company on y day for specific protest day.</p>
</div>",,,,,False,False,False,{},,,False,/r/Liberal/comments/v825zn/serious_question_would_it_be_safe_to_eat_at/ibov00q/,public,False,,1654744438.0,,[],t3_v825zn,r/Liberal,0,0,,,[],,6,True,2023-10-14T11:24:58.788597,"Thursday, June 09, 2022, at 11:13:58 AM",A1steaksauceTrekdog7,True,v825zn,,4x7nxqxx
2qxt5,,False,,[],,,text,0,,,[],False,ibofpxk,,,0,True,,False,False,1654736734.0,True,v825zn,4,t2_2vfy5qgw,,,[],False,"Sadly we elect people into real political power with money, obviously not a great system. Buying a water bottle is like casting a vote.",False,,,t1_ibofpxk,False,0,[],False,"<div class=""md""><p>Sadly we elect people into real political power with money, obviously not a great system. Buying a water bottle is like casting a vote.</p>
</div>",,,,,False,False,False,{},,,False,/r/Liberal/comments/v825zn/serious_question_would_it_be_safe_to_eat_at/ibofpxk/,public,False,,1654736734.0,,[],t3_v825zn,r/Liberal,0,0,,,[],,4,True,2023-10-14T11:24:59.206619,"Thursday, June 09, 2022, at 09:05:34 AM",kin4212,True,v825zn,,2vfy5qgw
2qxt5,,False,,[],,,text,0,,,[],False,ibofpn6,,,0,True,,False,False,1654736731.0,True,v825zn,8,t2_4b1d4,,,[],False,"Well thanks for the info, I won't be giving them my money any more than I give uline my money.",False,,,t1_ibofpn6,False,0,[],False,"<div class=""md""><p>Well thanks for the info, I won&#39;t be giving them my money any more than I give uline my money.</p>
</div>",,,,,False,False,False,{},,,False,/r/Liberal/comments/v825zn/serious_question_would_it_be_safe_to_eat_at/ibofpn6/,public,False,,1654736731.0,,[],t3_v825zn,r/Liberal,0,0,,,[],,8,True,2023-10-14T11:24:59.612727,"Thursday, June 09, 2022, at 09:05:31 AM",CaptOblivious,True,v825zn,,4b1d4
2qxt5,,False,,[],,,text,0,,,[],False,ibo06jp,,,0,True,,False,False,1654728954.0,True,v825zn,15,t2_8na6yq,,,[],False,If you are cool with your money being siphoned knowingly into nefarious causes I say go for it,False,,,t1_ibo06jp,False,0,[],False,"<div class=""md""><p>If you are cool with your money being siphoned knowingly into nefarious causes I say go for it</p>
</div>",,,,,False,False,False,{},,,False,/r/Liberal/comments/v825zn/serious_question_would_it_be_safe_to_eat_at/ibo06jp/,public,False,,1654728954.0,,[],t3_v825zn,r/Liberal,0,0,,,[],,15,True,2023-10-14T11:25:00.009650,"Thursday, June 09, 2022, at 06:55:54 AM",thep1x,True,v825zn,,8na6yq
