2qxt5,,False,,[],,,text,0,,,[],False,k16is85,,,0,False,,False,False,1695070812.0,True,k10vc2u,1,t2_bxy3t,,,[],False,"People are allowed to feel how they feel, there's an abundance of reasons to be angry.  
 
And hey, let's be honest, here, hatred has one huge advantage: It lets you turn your empathy off.  
  
If bad things happen to *those people,* so much the better, right?  They deserve it for the way they act, and if they wanted me to care about them, maybe they shouldn't have made me hate them so much.   
  
Hatred has its advantages.  Do you remember r-HermanCainAwards?   Hateful people found that subreddit **hilarious,** it was fresh schadenfreude every day for a while there!  Without hatred, how could so many of us have laughed at so many of our countrymen dying by the hundreds and thousands every day?   Without hatred, we might have seen those deaths as a tragedy rather than a punchline.  
  
I completely understand why people turn to hate.  Hate is easy.  Hate is **flat.**  There's no depth because there doesn't need to be.  You don't need to understand *why* the person you hate is acting the way they are, you don't even have to see the other person as fully human, you can tuck your empathy and compassion away and save it for more deserving people.  
  
Hate is easy, I get it, it's an autopilot emotion, and hell, it's working well for conservatives.",False,,,t1_k16is85,True,0,[],False,"<div class=""md""><p>People are allowed to feel how they feel, there&#39;s an abundance of reasons to be angry.  </p>

<p>And hey, let&#39;s be honest, here, hatred has one huge advantage: It lets you turn your empathy off.  </p>

<p>If bad things happen to <em>those people,</em> so much the better, right?  They deserve it for the way they act, and if they wanted me to care about them, maybe they shouldn&#39;t have made me hate them so much.   </p>

<p>Hatred has its advantages.  Do you remember r-HermanCainAwards?   Hateful people found that subreddit <strong>hilarious,</strong> it was fresh schadenfreude every day for a while there!  Without hatred, how could so many of us have laughed at so many of our countrymen dying by the hundreds and thousands every day?   Without hatred, we might have seen those deaths as a tragedy rather than a punchline.  </p>

<p>I completely understand why people turn to hate.  Hate is easy.  Hate is <strong>flat.</strong>  There&#39;s no depth because there doesn&#39;t need to be.  You don&#39;t need to understand <em>why</em> the person you hate is acting the way they are, you don&#39;t even have to see the other person as fully human, you can tuck your empathy and compassion away and save it for more deserving people.  </p>

<p>Hate is easy, I get it, it&#39;s an autopilot emotion, and hell, it&#39;s working well for conservatives.</p>
</div>",,,,,False,False,False,{},,,False,/r/Liberal/comments/16l28bs/rant_no_i_do_not_hate_conservatives_and_no_hatred/k16is85/,public,False,,1695070812.0,,[],t3_16l28bs,r/Liberal,0,2,,,[],,1,True,2023-10-15T09:03:40.564121,"Tuesday, September 19, 2023, at 05:00:12 AM",OneYearSteakDay,False,16l28bs,k10vc2u,bxy3t
2qxt5,,False,,[],,,text,0,,,[],False,k10lpg9,,,0,False,,False,False,1694974826.0,True,16l28bs,11,t2_ke1k1,,,[],False,"I think this is one of the core differences in the overall values of liberals and conservatives. Liberals want to make life better for everyone (safe for maybe billionaires, who would still be insanely well off if we enacted more progressive taxation) whereas conservatives seem more concerned about preserving the status quo and then enacting legislation that hurts the ""right"" people. They aren't looking to make the country better for poor people or minorities because they don't want those people to do as well as them.",False,,,t1_k10lpg9,False,0,[],False,"<div class=""md""><p>I think this is one of the core differences in the overall values of liberals and conservatives. Liberals want to make life better for everyone (safe for maybe billionaires, who would still be insanely well off if we enacted more progressive taxation) whereas conservatives seem more concerned about preserving the status quo and then enacting legislation that hurts the &quot;right&quot; people. They aren&#39;t looking to make the country better for poor people or minorities because they don&#39;t want those people to do as well as them.</p>
</div>",,,,,False,False,False,{},,,False,/r/Liberal/comments/16l28bs/rant_no_i_do_not_hate_conservatives_and_no_hatred/k10lpg9/,public,False,,1694974826.0,,[],t3_16l28bs,r/Liberal,0,0,,,[],,11,True,2023-10-15T09:03:41.005618,"Monday, September 18, 2023, at 02:20:26 AM",l3g3ndairy,True,16l28bs,,ke1k1
2qxt5,,False,,[],,,text,0,,,[],False,k10zeaz,,,0,False,,False,False,1694979545.0,True,16l28bs,7,t2_5xtxfa4b,,,[],False,I know I’m in the minority here… But I do indeed despise conservatives and my hatred for them is definitely one reason (but not the only reason) why I vote for liberal candidates… I don’t care about the outcome for a bunch of hicks that vote against their interests. They can lie in their bed after they made it.,False,,,t1_k10zeaz,False,0,[],False,"<div class=""md""><p>I know I’m in the minority here… But I do indeed despise conservatives and my hatred for them is definitely one reason (but not the only reason) why I vote for liberal candidates… I don’t care about the outcome for a bunch of hicks that vote against their interests. They can lie in their bed after they made it.</p>
</div>",,,,,False,False,False,{},,,False,/r/Liberal/comments/16l28bs/rant_no_i_do_not_hate_conservatives_and_no_hatred/k10zeaz/,public,False,,1694979545.0,,[],t3_16l28bs,r/Liberal,0,0,,,[],,7,True,2023-10-15T09:03:41.450089,"Monday, September 18, 2023, at 03:39:05 AM",I_TotallyPaused,True,16l28bs,,5xtxfa4b
2qxt5,,False,,[],,,text,0,,,[],False,k119ilh,,,0,False,,False,False,1694983010.0,True,16l28bs,12,t2_6dm2t6aq,,,[],False,"My feelings towards conservatives range from disdain to hatred.

I hate Matt Walsh. I hate Michael Knowles. I hate every single piece of shit endangering me and my fellow queer and trans people.

I hate Trump. I hate every person that helped contribute to the current situation in our country, or directly influenced it.

I hold disdain for the stupid fucking idiots that can't even be bothered to look into the issues facing us. I hold disdain for every motherfucker who pulls ""both sides"" whenever these issues are brought up.

The Nazis weren't beaten by the Allies having compassion for them. They were stomped into the fucking ground.",False,,,t1_k119ilh,False,0,[],False,"<div class=""md""><p>My feelings towards conservatives range from disdain to hatred.</p>

<p>I hate Matt Walsh. I hate Michael Knowles. I hate every single piece of shit endangering me and my fellow queer and trans people.</p>

<p>I hate Trump. I hate every person that helped contribute to the current situation in our country, or directly influenced it.</p>

<p>I hold disdain for the stupid fucking idiots that can&#39;t even be bothered to look into the issues facing us. I hold disdain for every motherfucker who pulls &quot;both sides&quot; whenever these issues are brought up.</p>

<p>The Nazis weren&#39;t beaten by the Allies having compassion for them. They were stomped into the fucking ground.</p>
</div>",,,,,False,False,False,{},,,False,/r/Liberal/comments/16l28bs/rant_no_i_do_not_hate_conservatives_and_no_hatred/k119ilh/,public,False,,1694983010.0,,[],t3_16l28bs,r/Liberal,0,0,,,[],,12,True,2023-10-15T09:03:41.876390,"Monday, September 18, 2023, at 04:36:50 AM",Hero_of_Parnast,True,16l28bs,,6dm2t6aq
2qxt5,,False,,[],,,text,0,,,[],False,k15fb28,,,0,False,,False,False,1695056822.0,True,k119ilh,0,t2_i2b3l3ux8,,,[],True,"The thing is, hate is only going to help conservatives in the end. Sure, hate could inspire you to fight them through action, setting good examples, voting. But hate in and of itself is exactly what the right wants. They thrive in this environment. They want polarization, they want bipartisan media, they want emotional discourse and echo chambers on both sides. When political discourse devolves into hate as it's main driver, it's always the populists who win. Always. 

The Nazis were beaten by soldiers with guns. Any comparison to keyboard warriors posting incendiary shit online is just wrong. Not saying that's what you were saying, but it is what a lot of people online seem to believe. 

While in reality, liberal hate just fuels the conservative machine at the cost of a healthy democracy.  People who truly want to beat the conservatives should heal the democracy first, because a healthy democracy is poison for the current conservatives. But you can't heal a democracy with hate.",False,,,t1_k15fb28,False,0,[],False,"<div class=""md""><p>The thing is, hate is only going to help conservatives in the end. Sure, hate could inspire you to fight them through action, setting good examples, voting. But hate in and of itself is exactly what the right wants. They thrive in this environment. They want polarization, they want bipartisan media, they want emotional discourse and echo chambers on both sides. When political discourse devolves into hate as it&#39;s main driver, it&#39;s always the populists who win. Always. </p>

<p>The Nazis were beaten by soldiers with guns. Any comparison to keyboard warriors posting incendiary shit online is just wrong. Not saying that&#39;s what you were saying, but it is what a lot of people online seem to believe. </p>

<p>While in reality, liberal hate just fuels the conservative machine at the cost of a healthy democracy.  People who truly want to beat the conservatives should heal the democracy first, because a healthy democracy is poison for the current conservatives. But you can&#39;t heal a democracy with hate.</p>
</div>",,,,,False,False,False,{},,,False,/r/Liberal/comments/16l28bs/rant_no_i_do_not_hate_conservatives_and_no_hatred/k15fb28/,public,False,,1695056822.0,,[],t3_16l28bs,r/Liberal,0,1,,,[],,0,True,2023-10-15T09:03:42.318766,"Tuesday, September 19, 2023, at 01:07:02 AM",Free_Bell_4188,False,16l28bs,k119ilh,i2b3l3ux8
2qxt5,,False,,[],,,text,0,,,[],False,k12mu6j,,,0,False,,False,False,1695003438.0,True,16l28bs,3,t2_5n29mlqh,,,[],False,"This was very well written, and I agree with 100% of it.",False,,,t1_k12mu6j,False,0,[],False,"<div class=""md""><p>This was very well written, and I agree with 100% of it.</p>
</div>",,,,,False,False,False,{},,,False,/r/Liberal/comments/16l28bs/rant_no_i_do_not_hate_conservatives_and_no_hatred/k12mu6j/,public,False,,1695003438.0,,[],t3_16l28bs,r/Liberal,0,0,,,[],,3,True,2023-10-15T09:03:42.758551,"Monday, September 18, 2023, at 10:17:18 AM",dmcguire05,True,16l28bs,,5n29mlqh
2qxt5,,False,,[],,,text,0,,,[],False,k10q0c2,,,0,False,,False,False,1694976330.0,True,16l28bs,2,t2_12zzhz,,,[],False,"I *hate* modern pop music  
And I *hate* old elevator music   
/s",False,,,t1_k10q0c2,False,0,[],False,"<div class=""md""><p>I <em>hate</em> modern pop music<br/>
And I <em>hate</em> old elevator music<br/>
/s</p>
</div>",,,,,False,False,False,{},,,False,/r/Liberal/comments/16l28bs/rant_no_i_do_not_hate_conservatives_and_no_hatred/k10q0c2/,public,False,,1694976330.0,,[],t3_16l28bs,r/Liberal,0,0,,,[],,2,True,2023-10-15T09:03:43.186171,"Monday, September 18, 2023, at 02:45:30 AM",positive_X,True,16l28bs,,12zzhz
2qxt5,,False,,[],,,text,0,,,[],False,k10vy5j,,,0,False,,False,False,1694978364.0,True,k10q0c2,3,t2_bxy3t,,,[],False,"Modern elevators with old music < Old elevators with modern music  
  
In that order.",False,,,t1_k10vy5j,True,0,[],False,"<div class=""md""><p>Modern elevators with old music &lt; Old elevators with modern music  </p>

<p>In that order.</p>
</div>",,,,,False,False,False,{},,,False,/r/Liberal/comments/16l28bs/rant_no_i_do_not_hate_conservatives_and_no_hatred/k10vy5j/,public,False,,1694978364.0,,[],t3_16l28bs,r/Liberal,0,1,,,[],,3,True,2023-10-15T09:03:43.631538,"Monday, September 18, 2023, at 03:19:24 AM",OneYearSteakDay,False,16l28bs,k10q0c2,bxy3t
2qxt5,,False,,[],,,text,0,,,[],False,k11450y,,,0,False,,False,False,1694981176.0,True,16l28bs,2,t2_dfyk5,,,[],False,"I don’t hate, I just feel bad.
It’s like having a computer that’s stuck in an error loop and you can’t reboot or reload it and you can clearly see it’s giving error after error and you know it’s about to crash",False,,,t1_k11450y,False,0,[],False,"<div class=""md""><p>I don’t hate, I just feel bad.
It’s like having a computer that’s stuck in an error loop and you can’t reboot or reload it and you can clearly see it’s giving error after error and you know it’s about to crash</p>
</div>",,,,,False,False,False,{},,,False,/r/Liberal/comments/16l28bs/rant_no_i_do_not_hate_conservatives_and_no_hatred/k11450y/,public,False,,1694981176.0,,[],t3_16l28bs,r/Liberal,0,0,,,[],,2,True,2023-10-15T09:03:44.059553,"Monday, September 18, 2023, at 04:06:16 AM",windsynth,True,16l28bs,,dfyk5
2qxt5,,False,,[],,,text,0,,,[],False,k122ufm,,,0,False,,False,False,1694994580.0,True,16l28bs,2,t2_75ft90x4,,,[],False,Agreed. But they’re not making it easy.,False,,,t1_k122ufm,False,0,[],False,"<div class=""md""><p>Agreed. But they’re not making it easy.</p>
</div>",,,,,False,False,False,{},,,False,/r/Liberal/comments/16l28bs/rant_no_i_do_not_hate_conservatives_and_no_hatred/k122ufm/,public,False,,1694994580.0,,[],t3_16l28bs,r/Liberal,0,0,,,[],,2,True,2023-10-15T09:03:44.501727,"Monday, September 18, 2023, at 07:49:40 AM",Desperate-Ad-6463,True,16l28bs,,75ft90x4
2qxt5,,False,,[],,,text,0,,,[],False,k138zmg,,,0,False,,False,False,1695015274.0,True,16l28bs,2,t2_gcw3w,,,[],False,"Wow, I agree with you 110%. I want the people in this country to thrive, and encourage policies that help make that happen. Every single citizen of the USA deserves to have a government that works for them. 

I don't vote *against* people, just vote for the ones who have a better set of ideas to make things better.  I will never support somebody whose intent is to take away people's rights or the things they depend on. You don't get to choose which Americans are more or less deserving of the advantages we all should enjoy. That's why I usually vote for somebody on the liberal end of the spectrum.",False,,,t1_k138zmg,False,0,[],False,"<div class=""md""><p>Wow, I agree with you 110%. I want the people in this country to thrive, and encourage policies that help make that happen. Every single citizen of the USA deserves to have a government that works for them. </p>

<p>I don&#39;t vote <em>against</em> people, just vote for the ones who have a better set of ideas to make things better.  I will never support somebody whose intent is to take away people&#39;s rights or the things they depend on. You don&#39;t get to choose which Americans are more or less deserving of the advantages we all should enjoy. That&#39;s why I usually vote for somebody on the liberal end of the spectrum.</p>
</div>",,,,,False,False,False,{},,,False,/r/Liberal/comments/16l28bs/rant_no_i_do_not_hate_conservatives_and_no_hatred/k138zmg/,public,False,,1695015274.0,,[],t3_16l28bs,r/Liberal,0,0,,,[],,2,True,2023-10-15T09:03:44.923296,"Monday, September 18, 2023, at 01:34:34 PM",StunGod,True,16l28bs,,gcw3w
2qxt5,,False,,[],,,text,0,,,[],False,k11rzln,,,0,False,,False,False,1694990027.0,True,16l28bs,2,t2_8aje6590,,,[],False,Magas are not conservatives.  True conservatives care about our democracy.,False,,,t1_k11rzln,False,0,[],False,"<div class=""md""><p>Magas are not conservatives.  True conservatives care about our democracy.</p>
</div>",,,,,False,False,False,{},,,False,/r/Liberal/comments/16l28bs/rant_no_i_do_not_hate_conservatives_and_no_hatred/k11rzln/,public,False,,1694990027.0,,[],t3_16l28bs,r/Liberal,0,0,,,[],,2,True,2023-10-15T09:03:45.343365,"Monday, September 18, 2023, at 06:33:47 AM",RAP1958,True,16l28bs,,8aje6590
2qxt5,,False,,[],,,text,0,,,[],False,k11ktct,,,0,False,,False,False,1694987138.0,True,16l28bs,0,t2_e8v2q,,,[],False,"You should vote liberal because their values more closely align with your own. I’m the same way that people should vote conservative because their values more closely align with their own. The idea that a particular political leaning “doesn’t care about people” is objectively propaganda. I’m not a conservative, but it’s not because I care about people more lol, it’s because there are specific values that I don’t agree with. We really need to stop making political ideology a moral one, that’s how you brainwash people.",False,,,t1_k11ktct,False,0,[],False,"<div class=""md""><p>You should vote liberal because their values more closely align with your own. I’m the same way that people should vote conservative because their values more closely align with their own. The idea that a particular political leaning “doesn’t care about people” is objectively propaganda. I’m not a conservative, but it’s not because I care about people more lol, it’s because there are specific values that I don’t agree with. We really need to stop making political ideology a moral one, that’s how you brainwash people.</p>
</div>",,,,,False,False,False,{},,,False,/r/Liberal/comments/16l28bs/rant_no_i_do_not_hate_conservatives_and_no_hatred/k11ktct/,public,False,,1694987138.0,,[],t3_16l28bs,r/Liberal,0,0,,,[],,0,True,2023-10-15T09:03:45.761415,"Monday, September 18, 2023, at 05:45:38 AM",Binarycold,True,16l28bs,,e8v2q
2qxt5,,False,,[],,,text,0,,,[],False,k0zzbi1,,,0,False,LOW_SCORE,False,False,1694966891.0,True,16l28bs,-10,t2_4r99yhxt,,,[],True,"This kind of ""holier than thou"" attitude really hurts the cause. Keep this to yourself next time",False,,,t1_k0zzbi1,False,0,[],False,"<div class=""md""><p>This kind of &quot;holier than thou&quot; attitude really hurts the cause. Keep this to yourself next time</p>
</div>",,comment score below threshold,,,False,False,False,{},,,False,/r/Liberal/comments/16l28bs/rant_no_i_do_not_hate_conservatives_and_no_hatred/k0zzbi1/,public,False,,1694966891.0,,[],t3_16l28bs,r/Liberal,0,0,,,[],,-10,True,2023-10-15T09:03:46.566148,"Monday, September 18, 2023, at 12:08:11 AM",Known_Study_7520,True,16l28bs,,4r99yhxt
2qxt5,,False,,[],,,text,0,,,[],False,k10197m,,,0,False,,False,False,1694967610.0,True,k0zzbi1,10,t2_bxy3t,,,[],False,">This kind of ""holier than thou"" attitude really hurts the cause. 

I don't think that not hating conservatives makes me any ""holier"" than the people who do hate conservatives, and frankly, if someone perceives compassion as sanctimonious, I don't think liberalism would have much appeal to that person, anyway.",False,,,t1_k10197m,True,0,[],False,"<div class=""md""><blockquote>
<p>This kind of &quot;holier than thou&quot; attitude really hurts the cause. </p>
</blockquote>

<p>I don&#39;t think that not hating conservatives makes me any &quot;holier&quot; than the people who do hate conservatives, and frankly, if someone perceives compassion as sanctimonious, I don&#39;t think liberalism would have much appeal to that person, anyway.</p>
</div>",,,,,False,False,False,{},,,False,/r/Liberal/comments/16l28bs/rant_no_i_do_not_hate_conservatives_and_no_hatred/k10197m/,public,False,,1694967610.0,,[],t3_16l28bs,r/Liberal,0,1,,,[],,10,True,2023-10-15T09:03:47.168799,"Monday, September 18, 2023, at 12:20:10 AM",OneYearSteakDay,False,16l28bs,k0zzbi1,bxy3t
2qxt5,,False,,[],,,text,0,,,[],False,k1061e4,,,0,False,,False,False,1694969367.0,True,k10197m,0,t2_4r99yhxt,,,[],False,"Cannot imagine describing someone who drafted a seven paragraph essay on reddit as sanctimonious. Imagine thinking you're special for having an opinion that ""we should help all people, EVEN conservatives."" Imagine thinking this is an opinion worth sharing. Honestly, embarrassing.",False,,,t1_k1061e4,False,0,[],False,"<div class=""md""><p>Cannot imagine describing someone who drafted a seven paragraph essay on reddit as sanctimonious. Imagine thinking you&#39;re special for having an opinion that &quot;we should help all people, EVEN conservatives.&quot; Imagine thinking this is an opinion worth sharing. Honestly, embarrassing.</p>
</div>",,,,,False,False,False,{},,,False,/r/Liberal/comments/16l28bs/rant_no_i_do_not_hate_conservatives_and_no_hatred/k1061e4/,public,False,,1694969367.0,,[],t3_16l28bs,r/Liberal,1,2,,,[],,0,True,2023-10-15T09:03:47.599363,"Monday, September 18, 2023, at 12:49:27 AM",Known_Study_7520,False,16l28bs,k10197m,4r99yhxt
2qxt5,,False,,[],,,text,0,,,[],False,k10a3zj,,,0,False,,False,False,1694970837.0,True,k1061e4,4,t2_bxy3t,,,[],False,"> Imagine thinking you're special 

Oh, shit!  Okay, sorry, I mistook you.  
  
Let me try it this way: I was accused of hating conservatives in another thread earlier today, and it's not the first time that accusation has been leveled at me or at liberals as a whole.  And I *don't* hate conservatives.  
  
You're telling me I'm not special, and you're absolutely right, I'm *not* special.  *Most* liberals don't hate conservatives, so hearing someone *say* ""You're just a liberal because you hate conservatives"" gets under my skin.  
  
I called this post a rant, and that's what it is, a rant.  Because you're right, this occurrence isn't *special,* it's fucking *boring* and *banal,* it happens thousands of times a day, and it's that fucking **ubiquity** that gets under my skin.  
  
I'm not special, I didn't write this because I think I'm special, I wrote this because I'm sick of interactions like these being so normal nowadays.  Who likes it when people make wrong assumptions about them?  
  
Some people get angry and smash their coffee makers, I get angry and write reddit posts.  I apologize that I expressed my opinion poorly, but if you come away from this conversation thinking of me as sanctimonious rather than hateful, [I'll see that as an absolute win.](https://i.imgur.com/1tvLpag.jpeg)",False,,,t1_k10a3zj,True,0,[],False,"<div class=""md""><blockquote>
<p>Imagine thinking you&#39;re special </p>
</blockquote>

<p>Oh, shit!  Okay, sorry, I mistook you.  </p>

<p>Let me try it this way: I was accused of hating conservatives in another thread earlier today, and it&#39;s not the first time that accusation has been leveled at me or at liberals as a whole.  And I <em>don&#39;t</em> hate conservatives.  </p>

<p>You&#39;re telling me I&#39;m not special, and you&#39;re absolutely right, I&#39;m <em>not</em> special.  <em>Most</em> liberals don&#39;t hate conservatives, so hearing someone <em>say</em> &quot;You&#39;re just a liberal because you hate conservatives&quot; gets under my skin.  </p>

<p>I called this post a rant, and that&#39;s what it is, a rant.  Because you&#39;re right, this occurrence isn&#39;t <em>special,</em> it&#39;s fucking <em>boring</em> and <em>banal,</em> it happens thousands of times a day, and it&#39;s that fucking <strong>ubiquity</strong> that gets under my skin.  </p>

<p>I&#39;m not special, I didn&#39;t write this because I think I&#39;m special, I wrote this because I&#39;m sick of interactions like these being so normal nowadays.  Who likes it when people make wrong assumptions about them?  </p>

<p>Some people get angry and smash their coffee makers, I get angry and write reddit posts.  I apologize that I expressed my opinion poorly, but if you come away from this conversation thinking of me as sanctimonious rather than hateful, <a href=""https://i.imgur.com/1tvLpag.jpeg"">I&#39;ll see that as an absolute win.</a></p>
</div>",,,,,False,False,False,{},,,False,/r/Liberal/comments/16l28bs/rant_no_i_do_not_hate_conservatives_and_no_hatred/k10a3zj/,public,False,,1694970837.0,,[],t3_16l28bs,r/Liberal,0,3,,,[],,4,True,2023-10-15T09:03:48.006036,"Monday, September 18, 2023, at 01:13:57 AM",OneYearSteakDay,False,16l28bs,k1061e4,bxy3t
2qxt5,,False,,[],,,text,0,,,[],False,k10cmhy,,,0,False,,False,False,1694971710.0,True,k10a3zj,-1,t2_4r99yhxt,,,[],False,Alright. Fair play. Carry on!,False,,,t1_k10cmhy,False,0,[],False,"<div class=""md""><p>Alright. Fair play. Carry on!</p>
</div>",,,,,False,False,False,{},,,False,/r/Liberal/comments/16l28bs/rant_no_i_do_not_hate_conservatives_and_no_hatred/k10cmhy/,public,False,,1694971710.0,,[],t3_16l28bs,r/Liberal,0,4,,,[],,-1,True,2023-10-15T09:03:48.433267,"Monday, September 18, 2023, at 01:28:30 AM",Known_Study_7520,False,16l28bs,k10a3zj,4r99yhxt
2qxt5,,False,,[],,,text,0,,,[],False,k10nrsl,,,0,False,,False,False,1694975544.0,True,k10cmhy,2,t2_bxy3t,,,[],False,What a pleasant surprise!,False,,,t1_k10nrsl,True,0,[],False,"<div class=""md""><p>What a pleasant surprise!</p>
</div>",,,,,False,False,False,{},,,False,/r/Liberal/comments/16l28bs/rant_no_i_do_not_hate_conservatives_and_no_hatred/k10nrsl/,public,False,,1694975544.0,,[],t3_16l28bs,r/Liberal,0,5,,,[],,2,True,2023-10-15T09:03:48.859362,"Monday, September 18, 2023, at 02:32:24 AM",OneYearSteakDay,False,16l28bs,k10cmhy,bxy3t
