,Unnamed: 0.1,Unnamed: 0,id,author_screen_name,author_id,body,permalink,created_utc,subreddit_name_prefixed,created_utc_string,label,prob,to_message_flag,has_been_messaged
0,0,0,jny88ue,Bennghazi,t2_638a58sx,That bathroom was perfectly secure.  It smelled so bad that no one wanted to go in there.,/r/democrats/comments/1482qvl/be_prepared_the_worst_may_still_be_yet_to_come/jny88ue/,1686620136.0,r/democrats,"Tuesday, June 13, 2023, at 09:35:36 AM",1,0.841012,1,1
1,1,1,jny6w45,1eyedbudz,t2_adt8jyn1,"I’m sure he had plans for the documents, and he probably already used some of them for nefarious purpose",/r/democrats/comments/1482qvl/be_prepared_the_worst_may_still_be_yet_to_come/jny6w45/,1686619345.0,r/democrats,"Tuesday, June 13, 2023, at 09:22:25 AM",0,0.00097149983,1,1
2,2,2,jnyg1xo,bostonmolasses,t2_3hvrm,Just to be pedantic: he is being arraigned tomorrow. They grand jury already indicted him.,/r/democrats/comments/1482qvl/be_prepared_the_worst_may_still_be_yet_to_come/jnyg1xo/,1686624692.0,r/democrats,"Tuesday, June 13, 2023, at 10:51:32 AM",1,0.9925474,1,1
3,3,3,jny7aq9,AuthorTomFrost,t2_la5mn,I'm looking forward to getting to the point where there's a fresh indictment every week.,/r/democrats/comments/1482qvl/be_prepared_the_worst_may_still_be_yet_to_come/jny7aq9/,1686619579.0,r/democrats,"Tuesday, June 13, 2023, at 09:26:19 AM",0,0.14255936,1,1
4,4,4,jnyd0la,Dictaorofcheese,t2_5egneozv,"I'm still pissed they're not putting him in handcuffs and doing mugshots. If we did any of this treasonous stuff, we'd get the complete works. I'm gonna be watching this Tuesday with absolute glee. As a former R/cultist now a D, I hope the guy gets life in prison once his sentence is read out next year. (I'm assuming it'll be next year.) And is found guilty on every charge. We can't go soft on national security breaches like this. It looks like they're not going soft on him, which I'm thrilled about.",/r/democrats/comments/1482qvl/be_prepared_the_worst_may_still_be_yet_to_come/jnyd0la/,1686622936.0,r/democrats,"Tuesday, June 13, 2023, at 10:22:16 AM",1,0.9836282,1,1
5,5,5,jnyb3se,Desperate-Ad-6463,t2_75ft90x4,"On top of that, Rachel just reminded me that Jack Smith is still working on the January 6 case where indictment for sedition might be the next thing to come in to play",/r/democrats/comments/1482qvl/be_prepared_the_worst_may_still_be_yet_to_come/jnyb3se/,1686621827.0,r/democrats,"Tuesday, June 13, 2023, at 10:03:47 AM",1,0.9966879,1,1
6,6,6,jnydc73,vakr001,t2_5ex19u7z,"A lot of people are saying they aren’t expecting much. 

This is the bullshit we heard about Merrick Garland investigating Trump. They aren’t going to plea deal on this one.

Have patience…",/r/democrats/comments/1482qvl/be_prepared_the_worst_may_still_be_yet_to_come/jnydc73/,1686623123.0,r/democrats,"Tuesday, June 13, 2023, at 10:25:23 AM",1,0.77756774,1,1
7,7,7,jnylwz6,routerg0d,t2_11cidq,Any country who had any spies worth anything already went through those boxes and photocopied everything.  Just look at the boxes they’ve clearly been opened and moved many times.  Cat’s out of the bag on all of that and some of that may cost us tens of billions in mitigations of the weapons programs he exposed.,/r/democrats/comments/1482qvl/be_prepared_the_worst_may_still_be_yet_to_come/jnylwz6/,1686628320.0,r/democrats,"Tuesday, June 13, 2023, at 11:52:00 AM",0,0.2916313,1,0
8,8,8,jnycct3,rdcomma,t2_a05hpgi0x,"DOJ's case is rock solid. 

My money is on Mr Tiny Hands delaying and dragging it out as long as he can, while he continues to milk poor sops for more donations. Then he'll do a Fox on Dominion case: cut a deal just before trial along the lines of: no jail time,  hefty fine amounting to much less than the donations he collected in a single month, and DOJ will insist on no more public office for a number of years.

As this deal won't be cut so soon,  he would have, in the meantime,  won the Republican nomination,  then lost to Biden in Nov 2024. So,  instead of political donations,  he'll start soliciting contributions for his new TV network in his ongoing fight against the forces of Dark Brandon.",/r/democrats/comments/1482qvl/be_prepared_the_worst_may_still_be_yet_to_come/jnycct3/,1686622553.0,r/democrats,"Tuesday, June 13, 2023, at 10:15:53 AM",1,0.69958836,1,1
9,9,9,jnyqjjw,RareBeautyEtsy,t2_kldkg,"I am not going to engage with any naysayers, I’m just going to keep asking them one question “Why are you supporting a traitor?”

And I am carrying a copy of the indictment with me. So if anybody tries to argue with me, I can pull that sucker right out. Have it in an envelope in my carry bag. 

This is a serious, serious thing. If he gets elected again, and pardons himself, then, commit more crimes, there’s going to be hell to pay.

There’s already how to pay, lots of people, I think, paid with their lives. We will never know the full extent of the damage he has done, but we’ve got to do everything that we can just stop him from becoming president again.",/r/democrats/comments/1482qvl/be_prepared_the_worst_may_still_be_yet_to_come/jnyqjjw/,1686631658.0,r/democrats,"Tuesday, June 13, 2023, at 12:47:38 PM",1,0.98120636,1,1
10,10,10,jnykifx,Randolpho,t2_3ad4y,It ain’t like their base *enjoys* reading,/r/democrats/comments/1485d8i/republicans_are_counting_on_people_not_to_read/jnykifx/,1686627396.0,r/democrats,"Tuesday, June 13, 2023, at 11:36:36 AM",1,0.5640289,1,1
11,11,11,jnyng3q,calumin,t2_ga0hc,I actually think a lot of Republicans would like everyone to read the indictment so they can stop pretending to like Trump and defend him in public. However they’re too cowardly to say what they really think so they go along with the stupid narrative that it’s a witch hunt.,/r/democrats/comments/1485d8i/republicans_are_counting_on_people_not_to_read/jnyng3q/,1686629377.0,r/democrats,"Tuesday, June 13, 2023, at 12:09:37 PM",1,0.9957126,1,0
12,12,12,jnym9im,OkEnvironment3961,t2_8y580wym,"Has trump said anything about his valet Walt Natua getting conspiracy charges as well?  Everything I see is ""Woe is me, they're out to get me""  he isn't even saying anything about prosecutors pursuing charges on anyone else. I know he doesn't feel bad about ruining people's lives, but you'd think he would at least frame it as the DOJ going after this poor guy just doing his job.",/r/democrats/comments/1485d8i/republicans_are_counting_on_people_not_to_read/jnym9im/,1686628557.0,r/democrats,"Tuesday, June 13, 2023, at 11:55:57 AM",0,0.04115195,1,0
13,13,13,jnypb9u,Chumptopia,t2_4fg69h0q,Republicans read?,/r/democrats/comments/1485d8i/republicans_are_counting_on_people_not_to_read/jnypb9u/,1686630719.0,r/democrats,"Tuesday, June 13, 2023, at 12:31:59 PM",0,0.009202333,1,0
14,14,14,jnym5ib,EvitaPuppy,t2_oqkls,"You don't even need to read it, just look at the pictures! SCI stuff in a bathroom! WTF?",/r/democrats/comments/1485d8i/republicans_are_counting_on_people_not_to_read/jnym5ib/,1686628481.0,r/democrats,"Tuesday, June 13, 2023, at 11:54:41 AM",0,0.005774437,1,0
15,15,15,jnynr7l,OkayAlfalfa,t2_tfs1wiym,Republicans are not well educated and I doubt half of them can read.,/r/democrats/comments/1485d8i/republicans_are_counting_on_people_not_to_read/jnynr7l/,1686629594.0,r/democrats,"Tuesday, June 13, 2023, at 12:13:14 PM",0,0.292771,1,0
16,16,16,jnyqxz3,its_the_smell,t2_fmpym,It'a so much easier to continue to live in fantasyland by letting Hannity or some other rich lying asshole spoonfeed you your opinions.,/r/democrats/comments/1485d8i/republicans_are_counting_on_people_not_to_read/jnyqxz3/,1686631978.0,r/democrats,"Tuesday, June 13, 2023, at 12:52:58 PM",1,0.97008413,1,0
17,17,17,jnysa2p,BuyOutWallStreet,t2_vhhsogwe,"That's a safe bet, because most of their voters can't read.",/r/democrats/comments/1485d8i/republicans_are_counting_on_people_not_to_read/jnysa2p/,1686633071.0,r/democrats,"Tuesday, June 13, 2023, at 01:11:11 PM",0,0.0033780022,1,0
18,18,18,jnyx7c0,FickleSystem,t2_6cxxvz7m,"I mean, does it matter?? He could come out and say fuck yes I did it I even sold nuclear secrets to putin! And those assholes wouldn't care and still vote for him",/r/democrats/comments/1485d8i/republicans_are_counting_on_people_not_to_read/jnyx7c0/,1686637400.0,r/democrats,"Tuesday, June 13, 2023, at 02:23:20 PM",0,0.005802686,1,0
19,19,19,jnwwsss,wenchette,t2_cuaz7,"Referenced article:

https://www.vanityfair.com/news/2022/04/jared-kushner-saudi-arabia-2-billion-investment",/r/democrats/comments/147sxlc/i_wonder_where_that_top_secret_classified/jnwwsss/,1686593722.0,r/democrats,"Tuesday, June 13, 2023, at 02:15:22 AM",0,0.0033028428,0,0
20,20,20,jnwyplb,dtruth53,t2_1yff2yk,"I’m thinking he “invested” much of that money to pave the way for LIV golf’s takeover of the PGA. Donald was already hosting LIV tournaments after having had the 2022 PGA Championship taken away from his course, because of his actions on Jan. 6th . Now he’ll get to host LIV and PGA tournaments.

So now, the Orange insurrectionist and his 9/11 terrorist Buddy get everything they want. Sportswashing both 9/11 and Jan 6 in one big transaction. Winner winner, chicken dinner. And fat ass gets a fat paycheck",/r/democrats/comments/147sxlc/i_wonder_where_that_top_secret_classified/jnwyplb/,1686594712.0,r/democrats,"Tuesday, June 13, 2023, at 02:31:52 AM",1,0.9978083,1,0
21,21,21,jnx6843,incignita,t2_wg9wmjm,Buried in his ex-wife's  incredibly heavy casket,/r/democrats/comments/147sxlc/i_wonder_where_that_top_secret_classified/jnx6843/,1686598625.0,r/democrats,"Tuesday, June 13, 2023, at 03:37:05 AM",1,0.9964492,1,0
22,22,22,jnxeabh,Diligent_Excitement4,t2_gy1rwcof,"If the Saudis get the bomb, we know who we can thank",/r/democrats/comments/147sxlc/i_wonder_where_that_top_secret_classified/jnxeabh/,1686602795.0,r/democrats,"Tuesday, June 13, 2023, at 04:46:35 AM",0,0.00034989227,1,0
23,23,23,jnx6l2c,1eyedbudz,t2_adt8jyn1,So he hosted the Saudi when all the docs where in the bathroom/ballroom!,/r/democrats/comments/147sxlc/i_wonder_where_that_top_secret_classified/jnx6l2c/,1686598807.0,r/democrats,"Tuesday, June 13, 2023, at 03:40:07 AM",0,0.0013177356,1,0
24,24,24,jnxmacl,littleoldlady71,t2_6z8hw60h,And I still connect him to Kashogi’s Murder.,/r/democrats/comments/147sxlc/i_wonder_where_that_top_secret_classified/jnxmacl/,1686607101.0,r/democrats,"Tuesday, June 13, 2023, at 05:58:21 AM",0,0.0064624455,1,0
25,25,25,jny325q,takeitallback73,t2_c031gjmk,The only thing sadder than having Trump is having trump voters,/r/democrats/comments/147sxlc/i_wonder_where_that_top_secret_classified/jny325q/,1686617083.0,r/democrats,"Tuesday, June 13, 2023, at 08:44:43 AM",0,0.008692417,0,0
26,26,26,jnxar23,SapperInTexas,t2_8qxfs,"I read this headline in Jerry Reed's voice. 

""I wonder where the Loozyanna sheriff went to.... You can sho' get lost inna Loozyanna bayou!""",/r/democrats/comments/147sxlc/i_wonder_where_that_top_secret_classified/jnxar23/,1686600958.0,r/democrats,"Tuesday, June 13, 2023, at 04:15:58 AM",0,0.00032796178,1,0
27,27,27,jnxe8qy,Diligent_Excitement4,t2_gy1rwcof,Or the nuclear secrets he had stored in his office 🤔🤔,/r/democrats/comments/147sxlc/i_wonder_where_that_top_secret_classified/jnxe8qy/,1686602771.0,r/democrats,"Tuesday, June 13, 2023, at 04:46:11 AM",0,0.0010222358,1,0
28,28,28,jnxn3hu,TillThen96,t2_3qxeqlwj,"Wherever it went, the ""plans"" are useless to the US and her allies, now.  How many millions, years of placing strategic assets, millions (billions?) down the toilet he was addicted to flushing.  Apparently, his ""toilets"" may have the names as foreign countries.",/r/democrats/comments/147sxlc/i_wonder_where_that_top_secret_classified/jnxn3hu/,1686607560.0,r/democrats,"Tuesday, June 13, 2023, at 06:06:00 AM",1,0.9979658,1,0
29,29,29,jnxvni5,tickitytalk,t2_bpo6v,If only they were treated with the seriousness of a black man trying to sell a single cigarette on a street corner,/r/democrats/comments/147tkd2/trumps_threat_to_democracy_is_for_real_and_must/jnxvni5/,1686612562.0,r/democrats,"Tuesday, June 13, 2023, at 07:29:22 AM",1,0.9568775,1,0
30,30,30,jnx4f7m,JennyFromdablock2020,t2_im68bf2i,"GQP: Best we can do about this is try to unalive queer and trans people...

Democrats have to win elections, lives are on the line.",/r/democrats/comments/147tkd2/trumps_threat_to_democracy_is_for_real_and_must/jnx4f7m/,1686597687.0,r/democrats,"Tuesday, June 13, 2023, at 03:21:27 AM",0,0.00075263815,1,0
31,31,31,jnwzi05,rascible,t2_igkefh8t,"He kept those papers on purpose, and goaded doj to react. His numbers are up..",/r/democrats/comments/147tkd2/trumps_threat_to_democracy_is_for_real_and_must/jnwzi05/,1686595124.0,r/democrats,"Tuesday, June 13, 2023, at 02:38:44 AM",0,0.020009601,0,0
32,32,32,jnxtlsx,appmanga,t2_3gzga,"If anyone else is stupid enough to go to jail for Donald Trump, they need to give Stewart Rhodes a call first.              

It's simplistic, but I want to hear from his sycophants and cult members what would they think if the name in and on the indictment wasn't Donald Trump, but Barack Obama.",/r/democrats/comments/147tkd2/trumps_threat_to_democracy_is_for_real_and_must/jnxtlsx/,1686611334.0,r/democrats,"Tuesday, June 13, 2023, at 07:08:54 AM",1,0.9980517,1,0
33,33,33,jnxczyf,Diligent_Excitement4,t2_gy1rwcof,He needs to be arrested and put away for life.,/r/democrats/comments/147tkd2/trumps_threat_to_democracy_is_for_real_and_must/jnxczyf/,1686602123.0,r/democrats,"Tuesday, June 13, 2023, at 04:35:23 AM",0,0.15433933,0,0
34,34,34,jnxrqf6,Cocky_Jockey,t2_86vkmzae,"The evidence against Trump is overwhelming by any standard, yet nearly half the country believes this is all made up by Joe Biden's DOJ to keep Trump from running against him in the 2024 election.  WTF is wrong with these people?  What happened to America?  Is it all right-wing media that's brain-washed these people?  Is it fear and ignorance being stoked by Faux News, Newsmax, et al that has forced them to believe all the conspiracy and ""deep state"" nonsense?  Is it the same fear and ignorance that under-educated blue collar white people are manifesting their frustration over in a strange new world that apparently seeks to marginalize their place in American society?    


Rhetorical question I suppose...I realize the true answer is too voluminous and without possible resolution anyway, so what's the use?  If we can't agree on the veracity of established facts, I don't see how there's any way out of this mess.  If you believe the sky is green and I can't talk you into realizing it's actually blue, it's game over from my perspective.

Depressing.  I fear for my children and grandchildren.",/r/democrats/comments/147tkd2/trumps_threat_to_democracy_is_for_real_and_must/jnxrqf6/,1686610233.0,r/democrats,"Tuesday, June 13, 2023, at 06:50:33 AM",1,0.76144713,1,0
35,35,35,jnx5x37,Btravelen,t2_13bdx64x,I hope Don the Con remains around long enough to continue destroying the Con Party,/r/democrats/comments/147tkd2/trumps_threat_to_democracy_is_for_real_and_must/jnx5x37/,1686598469.0,r/democrats,"Tuesday, June 13, 2023, at 03:34:29 AM",0,0.44008702,1,0
36,36,36,jnwzmxq,parallelmeme,t2_qvhr2jp,... and not just rhetoric.,/r/democrats/comments/147tkd2/trumps_threat_to_democracy_is_for_real_and_must/jnwzmxq/,1686595196.0,r/democrats,"Tuesday, June 13, 2023, at 02:39:56 AM",0,0.015438991,0,0
37,37,37,jnxsffz,glitch83,t2_377d9,"Meh, just try to attack the capital again and see if we are fucking around",/r/democrats/comments/147tkd2/trumps_threat_to_democracy_is_for_real_and_must/jnxsffz/,1686610639.0,r/democrats,"Tuesday, June 13, 2023, at 06:57:19 AM",1,0.70638096,1,0
38,38,38,jnxxnmi,According_Project_93,t2_9pe7ysst,Vote for every election that comes up. I can’t wait to hear about all the other things that he’s done that we haven’t heard about! I think it’s worse than we know 😳😩,/r/democrats/comments/147tkd2/trumps_threat_to_democracy_is_for_real_and_must/jnxxnmi/,1686613789.0,r/democrats,"Tuesday, June 13, 2023, at 07:49:49 AM",0,0.0681306,1,0
