,Unnamed: 0,id,author_screen_name,author_id,body,permalink,created_utc,subreddit_name_prefixed,created_utc_string,label,prob,to_message_flag
0,0,i3tz4ky,AutoModerator,t2_6l4z3,"
""Please note that this is a **Republican** subreddit. Please mind our [rules](/r/Republicans Rules](https://www.reddit.com/r/Republicans/about/rules/). Trolls and anyone who violates the rules stated in this message may be banned."" 

*I am a bot, and this action was performed automatically. Please [contact the moderators of this subreddit](/message/compose/?to=/r/republicans) if you have any questions or concerns.*",/r/republicans/comments/tyqdj4/woke_elementary_school_employees_take_on_ron/i3tz4ky/,1649375845.0,r/republicans,"Friday, April 08, 2022, at 07:57:25 AM",0,0.0004772,1
1,1,i8p577t,TitanMU,t2_19p2zmg1,Conservatives when their child acknowledges gay existence: GROOMER!! THEY ARE GROOMING MY CHILD!!!,/r/republicans/comments/tyqdj4/woke_elementary_school_employees_take_on_ron/i8p577t/,1652624317.0,r/republicans,"Sunday, May 15, 2022, at 10:18:37 PM",1,0.83204204,1
2,2,iizmn3d,Slow-Vehicle-282,t2_dnj07fku,"Oh no, my 1 year old son will fail in life because he doesn't know what Pansexual is, I feel like he is giving me gay vibes after telling me he liked a male character in a cartoon more then a female one, now that Ron DeStantis passed the bill he will be able to learn actual history which we pay the schools for, what are we going to do...?

In all seriousness, I am pretty sure children don't need to know about gender ideology, it's not like we have been living without it before the 20th century.",/r/republicans/comments/tyqdj4/woke_elementary_school_employees_take_on_ron/iizmn3d/,1659658656.0,r/republicans,"Friday, August 05, 2022, at 08:17:36 AM",1,0.63982177,1
3,3,iclyrvv,RoadDog57350,t2_m0xg8vfl,Need to break and abolish all government unions.,/r/republicans/comments/tyqdj4/woke_elementary_school_employees_take_on_ron/iclyrvv/,1655402777.0,r/republicans,"Friday, June 17, 2022, at 02:06:17 AM",0,0.0004184728,0
4,4,j14zj41,WeTheLions,t2_v4dec4xu,It's time we stop worrying about this garbage and focus on what matters. Moving the economy forward again. We didn't send anyone to the moon by talking about this stuff.,/r/republicans/comments/tyqdj4/woke_elementary_school_employees_take_on_ron/j14zj41/,1671647551.0,r/republicans,"Thursday, December 22, 2022, at 02:32:31 AM",0,0.48378393,1
5,5,i4b9v35,SharpPoint8,t2_h24uz4dy,Yes,/r/republicans/comments/tyqdj4/woke_elementary_school_employees_take_on_ron/i4b9v35/,1649695100.0,r/republicans,"Tuesday, April 12, 2022, at 12:38:20 AM",0,0.0034368557,1
6,6,isjkxwh,jovi_goddard,t2_lkchoru,I guess I’m just confused on this whole situation. I thought school was for Math and Reading? I’m not even sure where or why these conversations take place.,/r/republicans/comments/tyqdj4/woke_elementary_school_employees_take_on_ron/isjkxwh/,1665929154.0,r/republicans,"Sunday, October 16, 2022, at 10:05:54 PM",0,0.032090988,0
7,7,igqafmc,OneMoreBasshead,t2_2h6ebebz,Is Desantis good? Why do people like him?,/r/republicans/comments/tyqdj4/woke_elementary_school_employees_take_on_ron/igqafmc/,1658199564.0,r/republicans,"Tuesday, July 19, 2022, at 10:59:24 AM",0,0.034712918,0
8,8,igut8p5,CriticalIncident4662,t2_q67jjonn,"Children should not be exposed to sex at such a young age,  I don't care if it's man in a woman,  woman in a man,  animal in a man,  animal in a woman, man in an animal, woman in an animal,  man in a man,  woman in a woman.
I'm not going to go through the genders this comment would have no end.",/r/republicans/comments/tyqdj4/woke_elementary_school_employees_take_on_ron/igut8p5/,1658278217.0,r/republicans,"Wednesday, July 20, 2022, at 08:50:17 AM",1,0.9974438,1
9,9,iib5126,atpierce2,t2_4wl4e59s,Yea cause only adults are apart of the lgbtqia+ community cause gay teens don’t exist got it,/r/republicans/comments/tyqdj4/woke_elementary_school_employees_take_on_ron/iib5126/,1659218809.0,r/republicans,"Sunday, July 31, 2022, at 06:06:49 AM",0,0.00038155718,1
10,10,icv0uoq,TheSmiling_Buddha,t2_1m4pdg41,Good,/r/republicans/comments/tyqdj4/woke_elementary_school_employees_take_on_ron/icv0uoq/,1655578778.0,r/republicans,"Sunday, June 19, 2022, at 02:59:38 AM",0,0.034139954,1
11,11,icvie25,YTKTV,t2_fmtcka8x,hey look at the man child!,/r/republicans/comments/tyqdj4/woke_elementary_school_employees_take_on_ron/icvie25/,1655587233.0,r/republicans,"Sunday, June 19, 2022, at 05:20:33 AM",0,0.001447958,0
12,12,ib69htt,AutoModerator,t2_6l4z3,"
""Please note that this is a **Republican** subreddit. Please mind our [rules](/r/Republicans Rules](https://www.reddit.com/r/Republicans/about/rules/). Trolls and anyone who violates the rules stated in this message may be banned."" 

*I am a bot, and this action was performed automatically. Please [contact the moderators of this subreddit](/message/compose/?to=/r/republicans) if you have any questions or concerns.*",/r/republicans/comments/v4vuuv/donald_trumps_speech_people_dont_want_to_hear/ib69htt/,1654370041.0,r/republicans,"Sunday, June 05, 2022, at 03:14:01 AM",0,0.0004772,1
13,13,im479wg,Idriselbowz,t2_7w219k2p,A treasonous person gets to tell us how we should react,/r/republicans/comments/v4vuuv/donald_trumps_speech_people_dont_want_to_hear/im479wg/,1661686421.0,r/republicans,"Sunday, August 28, 2022, at 07:33:41 PM",1,0.97675973,1
14,14,in5m16d,alonela,t2_q2u9sihn,His tax plan is basically the same as Biden’s. They both favor corporate America. Taxing the top .01% 20% while hardworking Americans bust their spines? While their children suffer? Both parties are culpable. Ban me.,/r/republicans/comments/v4vuuv/donald_trumps_speech_people_dont_want_to_hear/in5m16d/,1662360154.0,r/republicans,"Monday, September 05, 2022, at 02:42:34 PM",1,0.9938414,1
15,15,ibun0g9,Constant_Fun_7326,t2_b5bnekp4,He's a criminal that attempted a coupe.,/r/republicans/comments/v4vuuv/donald_trumps_speech_people_dont_want_to_hear/ibun0g9/,1654866267.0,r/republicans,"Friday, June 10, 2022, at 09:04:27 PM",1,0.6148827,1
16,16,iw3wuim,Frankfusion,t2_3xfby,Can we finally remove this thing from the front page it just looks ridiculous.,/r/republicans/comments/v4vuuv/donald_trumps_speech_people_dont_want_to_hear/iw3wuim/,1668282062.0,r/republicans,"Sunday, November 13, 2022, at 03:41:02 AM",0,0.0013662662,0
17,17,inhl8u1,SpecialistComposer44,t2_lgf1c25d,"**Republican politicians don't care about working class Americans.** Disagree? Leave a text or voicemail at my Google voice number (415) 763-7697 with your thoughts, which I will respond to in the next episode of my podcast ""Prove Me Wrong, Please"". Cheers!",/r/republicans/comments/v4vuuv/donald_trumps_speech_people_dont_want_to_hear/inhl8u1/,1662577641.0,r/republicans,"Thursday, September 08, 2022, at 03:07:21 AM",0,0.00065290264,1
18,18,idi0g5b,Olong-Jonson,t2_9gf0m82v,His kids don't drink either,/r/republicans/comments/v4vuuv/donald_trumps_speech_people_dont_want_to_hear/idi0g5b/,1656030526.0,r/republicans,"Friday, June 24, 2022, at 08:28:46 AM",0,0.15052293,0
19,19,idpg9a9,repetemusic123,t2_icjj3,He does uppers all the time,/r/republicans/comments/v4vuuv/donald_trumps_speech_people_dont_want_to_hear/idpg9a9/,1656176661.0,r/republicans,"Sunday, June 26, 2022, at 01:04:21 AM",0,0.000604699,0
20,20,ijokulx,BiggieAndTheStooges,t2_gtk7imi1,Looks like clickbait,/r/republicans/comments/v4vuuv/donald_trumps_speech_people_dont_want_to_hear/ijokulx/,1660108963.0,r/republicans,"Wednesday, August 10, 2022, at 01:22:43 PM",0,0.0060964897,0
21,21,imsra5d,Express_Pair6657,t2_dgru9afa,https://youtu.be/2ImDDz4mC8o,/r/republicans/comments/v4vuuv/donald_trumps_speech_people_dont_want_to_hear/imsra5d/,1662127716.0,r/republicans,"Friday, September 02, 2022, at 10:08:36 PM",0,0.079410166,0
22,22,io1xkz6,calm-lab66,t2_pagvxs13,Does anyone with sense still believe him?,/r/republicans/comments/v4vuuv/donald_trumps_speech_people_dont_want_to_hear/io1xkz6/,1662937031.0,r/republicans,"Monday, September 12, 2022, at 06:57:11 AM",0,0.0049344585,0
23,23,iolu8oi,Intelligent-Travel-1,t2_apaa6ixe,"Ouch, I just got hit with some bullshit.",/r/republicans/comments/v4vuuv/donald_trumps_speech_people_dont_want_to_hear/iolu8oi/,1663290014.0,r/republicans,"Friday, September 16, 2022, at 09:00:14 AM",1,0.7457462,1
24,24,iqkygb2,Device_Motor,t2_8qbxs2fb,Can someone invite me to the Right stuff dating app??,/r/republicans/comments/v4vuuv/donald_trumps_speech_people_dont_want_to_hear/iqkygb2/,1664593114.0,r/republicans,"Saturday, October 01, 2022, at 10:58:34 AM",0,0.00051253627,0
25,25,jm047sj,AutoModerator,t2_6l4z3,"
""Please note that this is a **Republican** subreddit. Please mind our [rules](/r/Republicans Rules](https://www.reddit.com/r/Republicans/about/rules/). Trolls and anyone who violates the rules stated in this message may be banned."" 

*I am a bot, and this action was performed automatically. Please [contact the moderators of this subreddit](/message/compose/?to=/r/republicans) if you have any questions or concerns.*",/r/republicans/comments/13udvqh/turns_out_that_florida_is_one_of_the_best_states/jm047sj/,1685315051.0,r/republicans,"Monday, May 29, 2023, at 07:04:11 AM",0,0.0004772,0
26,26,jm0e3qu,BigRadiation,t2_ffdqqyn,Common sense education!,/r/republicans/comments/13udvqh/turns_out_that_florida_is_one_of_the_best_states/jm0e3qu/,1685319862.0,r/republicans,"Monday, May 29, 2023, at 08:24:22 AM",0,0.008760724,0
27,27,jm0pes2,ARY616,t2_9szpc2c,Math is racist /s,/r/republicans/comments/13udvqh/turns_out_that_florida_is_one_of_the_best_states/jm0pes2/,1685325547.0,r/republicans,"Monday, May 29, 2023, at 09:59:07 AM",0,0.13501716,1
28,28,jm0hf4f,Olong-Jonson,t2_9gf0m82v,What good is all this financial nonsense if someone doesn't think men can have babies and 8 year olds aren't convinced they were born the wrong sex and need to learn about gay porn?,/r/republicans/comments/13udvqh/turns_out_that_florida_is_one_of_the_best_states/jm0hf4f/,1685321519.0,r/republicans,"Monday, May 29, 2023, at 08:51:59 AM",1,0.9979085,1
29,29,jlz8n3e,AutoModerator,t2_6l4z3,"
""Please note that this is a **Republican** subreddit. Please mind our [rules](/r/Republicans Rules](https://www.reddit.com/r/Republicans/about/rules/). Trolls and anyone who violates the rules stated in this message may be banned."" 

*I am a bot, and this action was performed automatically. Please [contact the moderators of this subreddit](/message/compose/?to=/r/republicans) if you have any questions or concerns.*",/r/republicans/comments/13u8e2x/desantis_says_he_would_pardon_trump_j6ers_as/jlz8n3e/,1685300951.0,r/republicans,"Monday, May 29, 2023, at 03:09:11 AM",0,0.0004772,0
